User_Name,User_Location,Stars,Entry_Date,Entry_Quote,Entry_Content
radioxenon,,1,04/18/2019,I was charged $8 for 2 minutes of riding which comes in at $240/hr.,"They clearly relay on false advertising which is pathetic. +$16/hr for a bike rental is usury to say the least. The fact that the pricing information is embedded five clicks down again demonstrates that this company is out to screw tourists and shirk any corporate responsibility. If you use this service read the fine print, know that after 90 minutes of bike riding you'll be charge $8/ 30 minute interval or fraction thereof. I was charge $8 for 2 minutes of riding which comes in at $240/hr which is my own little form of misrepresentation. I won't be using this company in the future and I can only imagine how many others have been burned by this company. Oh and one final note, the brakes on the bikes are crap."
Abigail B,,1,04/15/2019,"Random fees & absolutely no customer service -- don't use unless you're willing to pay $1,200 / bike","I live in the DC area and we've used the service a couple of times. It's such a great way to show friends the city. We used them most recently a couple of weeks ago for about two hours. We went to dock the bikes (there are guidelines for this, you watch videos, etc. to learn how) and began receiving texts that the bike wasn't docked. We returned to the docking station to make sure it was docked and did all their ""checks"" -- the bikes were docked. We called Capital Bikeshare three times and emailed twice that night, trying to solve the problem, but got no response. The next day we FINALLY got in touch with them and they immediately told us we'd be subject to a $1,200 stolen bike fee (?!). I explained the situation, that we had checked the bikes and tried to resolve the issue, and they said someone had JUST found the bike (?!) so they would make the feee $60 instead. I continued to ask questions and before long, when it was clear they weren't interested in what I was saying, I asked for a customer service number and the name of the representative. She said she didn't have to give me any information and hung up on me. I then contacted Lyft, the company who owns Capital Bikeshare, and was totally ignored for two weeks after multiple customer service tickets. (Keep in mind, they require your credit card info before you ride so they can charge you for anything they want afterward.) Ultimately, these bikes are a fun and cool idea. But know that if you ride them you're opening yourself up to $1,200 in fees if ANYTHING goes wrong (even if their technology fails!) with absolutely no customer service. I am not willing to take that risk, and unfortunately will not be using these bikes again."
jeremyraybrown,"Washington DC, District of Columbia",1,04/07/2019,SCAM ALERT!!!!!!!!!!!,"They have lots of crazy fees that are hidden in fine print. My wife and I rented 2 bike for fewer than 3 hours and were billed $92. NEVER use them. If you were to rent a few bikes for your family while visiting D.C. for just a half day, you could be billed $400 or more. This is a morally reprehensible business. They are evil. This is terrible. Check out my other reviews and you’ll find they are mostly joyful. That is proof this company is a special breed of con artist. I hate them as you can tell. The owner is garbage."
Ladymix17,,1,04/03/2019,I will never use it again.,"I recently bought a day pass for the bikes, rode them around while showing friends who visited from out of town around the monuments. Was charged $38, almost 5 times the amount for the day pass! They do not tell you at the kiosk or make it clear that you need to return the bike every 30 min and get a new one or else be charged extra fees- what’s the point of having a day pass then?! Its ridiculous and just stupid. What a waste, I could have gone with a cheaper option. I’ll be making sure to never use them again."
Lindsay K,,1,03/31/2019,Terrible Experience,We were on the bikes for an hour and they were great. Docked them properly and the green light turned on. We got a text saying they were docked properly and now we are being charged for not doing properly and calling and emailing them they hung up on us and refused to listen.
mjanep,"Boston, Massachusetts",5,03/31/2019,Great bikeshare program and app,"I think many negative reviews are due to user error. You have to understand that the rented bike must be returned within 39 minutes to avoid extra payment. I did 3 day rental, big savings vs. renting per day. Using smartphone app makes it very easy to see where bikes are available and where docks are free to return. The app can help plan a trip, and it shows preferred bike routes which are safer and less hilly. Much better than my home city app for its bikeshare program. Bring your helmet and then get out there to enjoy getting around DC!"
Thejammar,,1,03/20/2019,DO NOT USE,"Horrible experience. Rented bikes for less than 30 minutes. Returned and locked. Was charged $94 since it was ""out for 1 day and 3 hours."" They told me the docking light never turned green?? They were so generous in cutting my fee in half to $47 - only 5 times what it costs to rent for a day anyway. Don't waste your money or time with these people."
Tara W,,1,02/25/2019,Take an uber or rent a scooter,"Took the bike for what I thought would be a $2 and was charged $94 for ""improperly docking"" - I waited 30 to 45 seconds to see that the bike was fully locked before leaving the bike. I called to explain what happened and they didn't do anything. There were no reports of damage to the bike and it was docked the following day according to the manager. However, I am still required to pay over $40. This would have never been an issue had I taken Uber or rented a scooter, but I was hoping to save money."
GDJ13,"San Diego, California",1,01/01/2019,"Two bikes, $76 for 2 hours","Although we had fun riding in DC, I am annoyed that we were charged an additional $60 for unknown fees.  We chose the 24 hour option and rode for 2hours, total charge $76!!!"
Marissa M,,1,12/30/2018,DO NOT DO IT,"Worst mistake of renting a bike. We were exhausted from walking and in a sketchy part of town at night, trying to quickly access a bike and didn’t realize what we agreed to. We rode to the Lincoln memorial, parked, walked 5 steps away and took a picture and someone rode off on our bikes. On the scooters (that we used all day but we’re dead at this time) they had GPS’s and you can end your ride immediately if someone takes off on it. We didn’t realize the bikes weren’t like that (first time using it) and were devastated when they were gone, and read the “you’re responsible for up to $1200 if bike is not returned” part. Called customer service immediately and the nice lady reassured me if whoever stole them returned them, she would waive the fee. Well, the man I talked to today said he would not be able to do that and was super rude and said “well I could get my manager to review it but we don’t normally waive fees.. but like at least they returned the bike”... yes we’re SUPER grateful they returned the bikes... but it was 14hrs later (have to turn them in every 30min for no overage charges) so we were charged $94 each for a BIKE that we rode for maybe 20 minutes because we “abandoned it”... at the time I was frustrated because he was making it seem like I was lying to him about the lady saying she would waive the fee, so I said forget it because he was SO rude. It was a good 20 minutes while it lasted but if you’re in DC don’t you dare get off that bike at ALL for anything at all or you’ll be charged out the butt for a bike that isn’t even worth that much money. Rent a scooter, it’s cheaper in the long run and has a GPS. The lady in customer service was awesome, but the man who I spoke to today should not be in customer service at all. Such a shame because we enjoyed the bikes but we will not touch one again due to this awful experience. Find a different bike service. Get a scooter. Anything other than being possibly responsible for a $1200 charge for a freakin bicycle."
Lisap1971,"Ashland, Kentucky",1,12/27/2018,Do not do this,"We were visiting DC and my kids had rented scooters to get around town a couple times. There were none available so the decided to rent bikes. My daughter left one unattended (although in her line of site) briefly and it was stolen. She honestly didn’t understand how this worked. The kids assumed it worked like the scooters. We called the company who is of no help. They tell you to call DC police (yep, they’re super concerned over a stolen bike). Bottom line, my credit card was just charged $1200 for a maybe $200 bike. Just walk or get a scooter or buy a cheap Walmart bike and leave it there. It’ll be WAY cheaper. Zero stars if possible. "
Louise4travel,,1,11/05/2018,Do not move unless Capital Bikeshare says the bike is locked-and still no guarantee.,We rented 4 bikes in DC. Read the confusing fine print about the 30 minute docking requirement. Ok. Got it. Docked the bikes the first time and got notice that 1 was not locked. Confirmed all bikes were locked (could not be moved) and left to tour monuments. Came back 1 hour later and could only take 3 bikes because it said 1 was still out. That serial number was no longer there. We called company. They said it happens all the time and whoever took bike next would be docking it within 30 minutes. It is 24 hours later and the bike is not returned. Now they are telling us to file a police report. Police say it needed to be filed when bike was noticed it was missing and we are no longer in DC. Police also said they get tons of reports that this happens all the time. We are now being held responsible. Look at the screnshot of my texts. Notice how I get a text that the bike W20305 was docked and later get a text that it wasn't returned. We spent as much time calling their customer service as we did touring the sites.
Go12469605138,,1,11/01/2018,Capital Bike Share,Be aware of this bike share. There was no where on the screen that said you had to dock your bike every 30 minutes on a 24 hour pass. They charged our account over 100.00 extra instead of the 8.00 for 24 hours that you think you were paying. I read the instructions for 20 minutes and if there was a notification then its not visible and who wants to dock a bike every 30 minutes that is not long enough to tour anything and its also unnecessary its a Scam... Also be aware they will charge you 1200.00 for a 80.00 bike if you lose it.
dolphinchicks,,4,10/14/2018,Great way to get around,"We stayed a few blocks from the Capitol building and did not have a car. These bikes were our mode of transportation for 3 days! It was great. I will say, we had a few issues with the docks, but we worked it out. The ride from the Capitol to Lincoln Memorial was fantastic...especially at night! The ride back was a little rough...hence Capitol Hill - there really is a hill! There are docks everywhere! Give it a try...saves your feet and legs! And... the kids loved it! We had four teens and preteens...this was one of their favorite things to do!"
Jean S,,3,10/14/2018,Checking in every 30 min,"Which is ridiculous when you have a whole day pass!!! 
The system keep charging for 60 and 94 which I had to call to get refunded. Beware of them continuing to charge your credit card."
760es,"Upper Montclair, New Jersey",3,10/10/2018,Ride,"This service is an asset, not unlike the Citi bikes you will find in NYC. You will find docks of bikes throughout Washington and with a little patience you will be on one or two of these bikes to explore the city. My only grief was trying to get up and running as that process is far from intuitive. After downloading the app, selecting your bike, I confess it was not clear at first where one enters the code generated by the app to release the bike. Once we got that ironed out, we remained mindful that we only had 30 minutes to get them back to one of the docks, which we did but there was more confusion on our part on how to successfully lock them back up. Thankfully, I had a 13 year old in my company who diagnosed that problem but again, none of this is intuitive. The key is sorting all of that out in advance AND knowing how long you need the bike for. If 30 minutes puts too much pressure on you, I would opt for the longer periods as the increase in rental rate is not that cost prohibitive - it sounds like it is costly otherwise if you poorly estimate how much time you need."
255103Julie,"Perth, Australia",3,10/05/2018,Aussies unable to hire,"We were keen to ride around National Mall on a couple of bikes as it was a hot day. Unfortunately after trying to insert our credit card to obtain a ‘key’, it was rejected. Upon calling customer service we were told it was because our credit card wasn’t issued in US?! Ummmm, we are overseas visitors, of course we wouldn’t have a US credit card. We kept on trying as were advised to use the app. That proved unsuccessful too as we were unable to enter our Australian mobile number with the +61 prefix. It appears it’s only possible if you are a tourist from another state in USA. A little disappointing. We ended up walking..."
Тихомир П,,1,10/04/2018,"Rip off, even when you stop every 30 minutes","I was charged for almost $100, although I returned bikes on every 30 minutes... Story was that I did not dock bike (I did it almost 10 times that day) and that it was in use for 2 days and 20 hours... rubbish."
ukkim1958,"greenville, in",3,10/02/2018,"Fun ride, but tedious also ","Rode for nearly 4 hours today, capital one arena to all the memorials, around the White House, up to The Capital, Supreme Court, then back to the White House! A total of 21.7 miles! The tedious part is I had to dock my bike 8 times to avoid being charged for overages!! Good thing I downloaded the app or I wouldn’t have known to dock it every 30 min.Also, a note to riders, DC streets are very dangerous to ride on! Very very few bike lanes! And very very fast and testy car drivers!! So ride on sidewalks and paths when ever possible!"
Hobocht,Austria,1,09/25/2018,ATTENTION - total Ripp-off,"At the rental station is a price of 8 USD per day defined .... we took the bikes for 3 hours and finally 90 USD for each bike got debited of our credit card. The customer service refer to the ""small printed"" where the exact rate is defined. DON'T DO IT ... this are thieves"
PeterB11384,"Athens, Greece",4,09/24/2018,Convenient way of exploring DC,"In my opinion distances in DC (Mall, downtown, Dupont, Georgetown) are a bit too big to walk, a cab is often stuck in traffic and the subway stations don't cover the entire area nicely. So, there is a transportation void that bikes can fill perfectly. I loved using Capital Bikeshare for short urban trips. The bikes were OK (maintenance could be better) and there are many docking stations in the area. A bit of caution is needed: don't use your bike for longer than 30 mins in a row and plan carefully for the docking stations. They can be either empty (no bike available) or full (you can't park your bike there)."
Flyer816378,"Langwarrin, Australia",1,09/17/2018,RIP OFF!!,"Absolute rip off!! Hired 2 bikes and rode around dc.. expecting an $8 fee for each bike.. next day checked my credit card and $230 Au dollars taken out of my account... When I rang to question it, I was told about the parking it every half hour and you should’ve read the tiny screen.. all 100 pages of it.. They then offered to halve the charge which means $115 Au.. very expensive bike hire indeed tourist stay away"
S A,,1,09/15/2018,Nickel and dime you along with poor customer service,I rented three bikes. Returned all three and received text that one was not docked. I was forced to drive 35 minutes to where the bike were returned to check. All of them got a green light and would not come out after docked. Called customer service who started they received a error that started we didn't dock the bike correctly. She told me if she sent someone out it would be a extra fee. I went back to the place where the bikes were returned and they were locked into place. I will never rent from this place again. Save your money because they'll find a way to over charge you extra. Horrible!!!
Chelsie Z,,1,08/20/2018,Dock Every 30 Minutes!,"I went to visit some friends in the DC area. A few of my friends used JUMP to get an electric bike and I thought I was saving money by using Capital Bikeshare because it was $8 for a 24-hour membership. If you take a bike out, make sure you dock the bike every 30 minutes and rent it out again or you will get charged a late fee of $30 dollars. It is extremely sneaky and no one who is going around to see the sites are going to focus on how long they have had the bike out. It is absolutely heartbreaking that a trip of a few hours cost me $38 because I was unaware of their late charge policy. Capital Bikeshare, if you are reading this, please please please change your business model. This is seriously awful. I can either keep the bike for the time period I need or I will have to dock the bike after 30 minutes and rent it again. Your competitors in DC (JUMP specifically) are way ahead of you. I really regret not using them and I will not be using Capital Bikeshare again until they stop ripping tourists off."
Lindsey C,"Columbus, Ohio",1,08/20/2018,Read the fine print,"You must read the fine print. We thought this would be a perfect way to get from Falls Church to The Mall (a little over an hour ride on these bikes) but we didn't read the fine print. The $8 for a ""24-hour rental"" covers as many 30 minute rides as you want in a 24 hours. If you do not dock or switch bikes every 30 minutes you will be charged a late fee.I will say there numerous stations to make this possible but to need to set a timer to switch bikes to avoid a late fee makes this not worth it."
Tsukiji,"Mechanicsburg, Pennsylvania",4,08/13/2018,Great way to get around the Mall,"It was a bit confusing at first to figure out how to rent, but once we downloaded the app it was much easier. We rented at the Jefferson Memorial, road to Lincoln, walked to DAR, road back to Jefferson. The only hiccup was at the Vietnam Vets Memorial the bikes were all gone so we had to walk another block to pick up more (not an issue) and then when we wanted to return them the rack was full back at the Jefferson Memorial. Keep that in mind and think about alternative drop/pickup points an all is good. Bikes were easy to use, a bit heavy but that is to be expected and made for a great time."
SOECC2018,"Arlington, Virginia",1,08/13/2018,Suspicious Business Model - behind the fantastic idea!,"The purpose of Capital Bike Share seem's to be ""Declare Your Independence"" to the customers. But the truth is a Suspicious Business Model based on Intentionlly Misleading of the Prices. Very misleading unless you read the fine print. The rent station says. $8 for 24 hours. Most tourist just read that and rent a bike. You have to bring the bike back to a station, dock it within 30 mins and then you can rent it out again. We got popped $38 dollars each bike. Now when you are riding around looking at the attractions in DC, who is going to return a bike to a station that are spaced 1/4 mile apart. Honestly, it is the whole idea and unbelievable that partners like: Arlington County, The City of Alexandria, The Fairfax County can accept this. The tourists are left back with a feeling of Misuse credit card. And, when I called to get my refund, rep told me they get these calls all day long. What does that say for their program? Dishonest Business Based on Intentionally Misleading!!!"
Snot_Finder,Wyoming,5,08/11/2018,Read the rules,"This is the BEST way to get around central DC, the mall, and the monuments. Read the rules. Plan on short trips and turning in the bikes or exchanging them before 30 minutes expire. The app is very helpful. There are docks near every major site you might want to visit. Make sure you securely dock the bikes - green light."
Michael G,,4,08/06/2018,Fun way to see the town,"We spent an afternoon riding from the Lincoln memorial to the Capitol Building making many stops along the way. It was an amazing way to see the monuments, reflecting pond, mall, WWII, and so much more. Tip, once you have your bike hang on to it. These things are in high demand."
Colette P,,2,07/31/2018,Misleading pricing,"Be sure to read the pricing breakdown before renting a bike. All bikes are rented out at 30 minute intervals, even if you purchase a 24 (or more) hour pass. After the first thirty minutes, you will continue to be charged unless you return that bike and get a new one. This is not clearly laid out when you look at the pricing options and can run up your bill."
d3691g2170w,"Dallas, Texas",1,07/31/2018,Misleading,"Very misleading unless you read the fine print. The rent station says. $8 for 24 hours. Most tourist just read that and rent a bike. We made the mistake of not reading the fine print. There are usage fees. You have to bring the bike back to a station, dock it within 30 mins and then you can rent it out again. We got popped $28 dollars. Now when you are riding around looking at the attractions in DC, who is going to return a bike to a station that are spaced 1/4 mile apart. Worst concept ever for tourist. And, when I called to get my refund, rep told me they get these calls all day long. What does that say for their program? Misleading!!!"
CindyMcN,"Charlotte, North Carolina",4,07/30/2018,Fun way to get around,I love to ride bikes so whenever I can find them and it helps with all of the walking I definitely will ride a bike. The only downside to docked bikes in cities is that you have to dock every 30 minutes or you get charged extra so that adds a little anxiety to the ride but other than that the price is right and saves a lot of steps. It is also great after a large dinner to burn off some calories. We bought the 24 hour pass and road quite a bit but one of the nicest rides was around the tidal basin. They have the basket type area in front but what would also be nice is a bike lock and the option to grab a helmet somewhere. Definitely recommend and have fun!!!
nkharris101,"St. Albans, United Kingdom",2,07/30/2018,Beware Bikeshare! Scam charges,No response so far. Please can someone contact me to confirm why I have been charged so much?My husband and I took 2 bikes out after paying for 2x 24hour passes. We got them from near Library of Congress and returned them in Georgetown about 2-2.5 hours later. Even your app confirms what I SHOULD have been charged. It logs the rides and how long between each docking. We paid for 2 bikes 24 hour hire. What an absolute scam!We’ve now been charged $60? It should have been $16. 
slcd2014,"Salt Lake City, Utah",5,07/29/2018,Great way to get around city,I came to DC with my 11 year old and we got a three day pass on Bikeshare - fun way to get around the city - best on the Mall - fun to be sure to dock within 30 min to not pay more. We did a monument ‘tour’ ride at night - safe and fun - less expensive and adaptable than a guided tour - the monuments have stations nearby and you can dock and then take the same bike back out
millergal88,Minneapolis,1,07/20/2018,Couldn't get a bike,"First stop only one bike. Went to the next. 2 bikes, one had a flat. Call them and they tell us a station near by with 6 bikes. Get to the 3rd station and only 3 bikes. Just as we paid 2 people had swabs and left us with one bike. Had to call to get our money back and gave up. It was a weekday in early June."
JenniferF520,"Rockaway, NJ",4,07/19/2018,Shocked by the bad reviews,"My nephew and I rented two bikes right on the mall. They were absolutely the highlight of the trip. I LOVED how much fun it was. I came here to leave a review and was shocked at how awful some of the reviews are. I had such a positive experience.The first place we stopped to rent bikes had a line, and only a few bikes, so we kept walking. About a half mile later, we found another rental spot with lots of bikes and nobody waiting.I did find the cost explanation posted to be very confusing. It was also not easy to read the tiny screen in the bright sun. But in the end, we got it figured out, and rented two bikes. My credit card was immediately charged $4 for two bikes for the first half hour. Let me tell you, the mall is huge. So riding down the sidewalk to the Lincoln Memorial was the best way to travel. We saved so much time! And it was so much fun! I haven't been on a bike for 15 years, and it's true what they say. You never forget how to ride a bike.The only drawback was the fact that there were so many people everywhere. It was hard to ride in that area, because of course, pedestrians have the right of way. The bikes had little bells to warn people you were passing, but most people really weren't paying attention to that. We kept our bikes a bit over the 30 minute limit, and when we docked them near the White House (I found docking locations on google maps) we were charged an additional $4 for the next half hour. Still, $8 for two bikes for 45 minutes was well worth it!I did have a little trouble docking my bike. I kept slamming it into the docking station, but never got the green light. My nephew had a softer touch, and he pushed it just a little bit tighter, and got the green. I liked having that reassurance that the bike was officially returned. I also liked that the docking station had a place to indicate if the bike had any problems associated with it, so it would be checked before being rented out again. I would absolutely get one of these bikes again, but perhaps during a less crowded time of year. I would also recommend the powers-that-be try to simplify the cost structure. It was too confusing."
