User_Name,User_Location,Stars,Entry_Date,Entry_Quote,Entry_Content
Kaleigh L,"St. Petersburg, Florida",1,06/04/2016,Fun but expensive $124 for two bikes,"Unfortunately I doubt we will ever use a bike share company again, barring the prices drop significantly. At first glance this seems like such a fantastic idea and such an amazing way to see our nation's capital. Unfortunately it is extremely expensive, I could have bought two used bikes on Craigslist in the capital for what we ended up paying for the two bike rental. 2 bikes for roughly 4 hours, came to a total of $124.00. And I do wish they had a water bottle holder. Also my bike kept slipping out of gear. The price really ruins the experience."
Lynne J,"Ipswich, United Kingdom",1,05/27/2016,Bad experience,"We planned to see the sights using this scheme- after a vain attempt to get 3 bikes from one station we walked to another and managed. We used these for 40 minutes and then spent several hours at Arlington, getting the metro back to the city and then tried to get a further set of bikes. The kiosk informed us that we still had the bikes and so couldn't get anymore. A phone call to the help line established that 1 of the three had a problem with docking- but they could do nothing about it- we could either get back and sort the problem at the last the docking statiin ourselves or an engineer would look at it some time in the next 48 hrs. Meantime the charge was continuing. Not impressed with this as we have used the same system in London on many occasions with no problems. Will not try it again- we will hire bikes for the day as this is cheaper than the excess charges on this scheme"
SebastianS4516,"Buenos Aires, Argentina",4,05/25/2016,Lovely way to visit DC,"It's very easy to get one of the bikes from the docking stations, that are located almost all around the important areas of the city's downtown, although it's not clear how to get a new bike once you left your first bike and try to get a new one at a new station. There's also an app which I haven't tried, I imagine it'd be helpful to try it. The stations are also in spanish."
randallscheessele,"Alexandria, Virginia",1,05/22/2016,Capital Bike Share needs to maintain their machines and not blame the customers,"I left a bike at Braddock Metro and properly locked it in. I checked it three times to make sure it was locked in. Customer service at first said that the bike could not be located. then they could see that it had been locked at the station but ""improperly so"". They said that they would have to send a technician out to see if it was still there. Their computers monitor these things and they could have sent a technician when it ""pinged"" as the lady called it. Better yet, they could check their stations to see if they are functioning when they move around the bikes each day."
foxsmjr,"Miami Beach, Florida",4,05/11/2016,"Great way to traverse the Mall, but be watchful of your time !","Capital Bikeshare is great, easy, and fun way to quickly zip around the National Mall taking in all the sights to see. My boyfriend and I took two bikes from the Jefferson Drive station - nearest the Washington Monument, and proceeded on a clockwise tour around the Tidal Basin taking in the Jefferson Memorial, George Mason Memorial, Tidal Basin sights and Cherry Trees, FDR Memorial, MLK Memorial, DC War Memorial, Lincoln Memorial, Reflecting Pool, Vietnam Memorial, 56 Signers of the Declaration and pool, the WWII Memorial, the White House, finally and Capitol Hill before riding our bikes back down the Hill past the Smithsonians and returning our bikes, ultimately back to the same original station on Jefferson Drive. Aggravatingly, between all those sights, there is only one station over between the FDR memorial and Lincoln memorial to park the bikes again and reset the 30 min free window of time. This makes it impossible to pay the $8 for a daily pass and maintain a free charge by staying under 30 mins, as there is simply not enough bike stations to check your bike back in, not to mention you'll find yourself easily spending at least 30 mins or more at each memorial if you really take your time to relax and take in the feeling of each sight. In the end, we were charged much more than we expected, but after doing the math it was the correct charge as advertised. In hind sight, I would do it again as riding the bikes sure did beat walking, (there is no way possible to cover that much ground on foot and not want to kill each other from exhaustion and aching feet), feeling the wind as you bike along, and laughing the whole way riding along made the entire experience on the Mall so much more enjoyable. Just be prepared to spend about $50 a person so you won't feel suckered when you see the charges appear on your card."
Amanda H,,1,05/11/2016,HORRRRRRIBLEEE SCAM ARTISTS,Horrible HORRRRRRRRible service. they say you have a 24 hour membership and then charge you for ever hour after 30 minutes. even worse customer service!
Iammerry,,2,05/10/2016,Be careful using your credit card ,I had a great time biking for 2 days in DC and was happy with the capital bikeshare. But then I found out that I was charged $54 and the transaction happened when I was no longer in DC. I called the customer service and was informed that my credit card was used at a location that I have never been to. They cancelled the transaction and I have to wait for 7-10 business days. Please check your credit card transactions after using the card for the bikeshare. I hope this won't happen again to anyone else. 
steph_tourstheworld,"Pompano Beach, Florida",2,05/09/2016,Broken & Full return stations make this less fun,"We rented some bikes as an easy way to make it around to see the monuments in the mall and tidal basin area. We left from the Lincoln memorial where we easily rented two bikes. We rode around the basin and attempted to turn in our bikes by the Jefferson memorial only to find the station full. This shouldnt have been a big problem because you can get an extra 15 minutes if the station is full, but the kiosk was broken. So I called the number for help, and they were unable to provide us with an extra 15 minutes over the phone. Finally we rode back round to the Washington Monument and returned our bikes there. When we went to take out new bikes after touring the monument, we couldnt...not sure why, but it wouldnt let us take a new bike with our codes, so we gave up. I've done this in other cities without issue, not sure why this particular program was so rough."
SpokaneLori,"Spokane, Washington",5,05/02/2016,Great way to see all the sights!,"We used Capital Bikeshare for the two days we were in DC with our two teenagers, and it was a lifesaver, and so much fun! It allowed us to see all of the sights, more than once, without having to walk everywhere or take other transit. I see some people complaining about the lack of docking stations near the museums, or the cost being high, yet we didn't find either of these to be the case. The key is to read the instructions...you can do so ahead of time online at their website. There is also a free app you can download ahead of time to help you find the docking stations. We found stations near all the places we went (Lincoln memorial, Space museum, capital, our hotel, etc.). To use them the most economically...rent them for 24 hours or 3 days. Then, as long as each time you ride them it's 30 minutes or less until you check it back in to a docking station, there is no charge. So we just got the bike, rode to the next sight we wanted to see, checked the bike in, explored the sight, and then got another bike to ride to the next sight. If you lock it up, then you're going to be paying for all that time that you aren't using it...just find a station, dock it, and get another bike once you're done exploring the memorial or the museum. A couple of times we used the bike over 30 minutes (like when we rode to Arlington Cemetery), and it was just $2 more. THE KEY IS TO CHECK THE BIKE IN, EXPLORE, AND THEN GET ANOTHER BIKE. Our kids loved this, and we did, too. And doing this at night all around the mall to see the beautiful lights was the highlight of our trip. The paths are large, and easy to maneuver on the bikes. And even riding to our hotel or to a restaurant, as long as the sidewalks weren't super crowded, we could just ride on the sidewalks. The bikes have a bell on them, so you can alert walkers that you are approaching. This is the way to go in DC!"
Silverbell603,"Keene, New Hampshire",1,05/01/2016,Scam! Do NOT give these criminals your money!,Shame on them for their predatory pricing! Promised $8 a day but charged $102 on credit card and when questioned said that riders need to dock the bikes every 30 minutes not to incur extra fees. The cowards use a 3rd party customer service department and won't release their own phone number. The customer service company says they regularly give50% back on the fees but aren't authorized to give more. They count on people giving up. It is obvious that they charge so high to suck hundreds of dollars out of many people & still laugh while getting 50% from those of us that call them on their scam. Don't ride - RUN! Run away from these scam artists.
Court701,"Bismarck, North Dakota",4,04/28/2016,Easy and cheap,This was the first time I had ever used any type of biking system in a big city. The bikeshare was easy to understand and was actually a pretty cheap was of transportation. I loved the fact that you could just grab one and then return it to a location where you were going. The only downside is that sometimes the dock you want to return it to is full and you end up having to ride around to find another one. But we did download the app which helped us find all the docks. Its really a nice way to see the city if you prefer not to walk. 
SMMHermans,"Monster, The Netherlands",4,04/25/2016,perfect with teenagers,"We have 2 teens (16 and 17) and they just loved visiting the city on bike. We have done a lot of citytrips and this time for the first on bike. The weather was nice and the traffic (sunday) was ok. Tip: you can only rent 2 bikes on 1 creditcard. so make sure you have enough cards! Make sure you print a good map at home so you can find the docks!! (or if you have internetacces, download the app!) We didn't and had to search a lot. What we didn't like: a few times there were not enough bikes in the docks for the four of us. And sometimes a few bikes just didn't got out the dock."
Z400VHpeterp,"Beenleigh, Australia",3,04/24/2016,"Need more bikes, more docks","GREAT idea, very convenient. But only if there are spare bikes where you wish to pick one up, and spare docks where you wish to end your journey. Can get expensive if you can't get to a dock within 30 mins of starting. Very tiring if there are no bikes left and you have to walk a long way to the next station. Otherwise a great option, cheaper than metro and enables you to see a lot more than you could on foot. "
AlisonStumpf,Minnesota,5,04/24/2016,Excellent and fun way to see the city,"My daughter and I were so glad when we figured out the 'deal' with the bikes and rented them for a evening trip to the monuments. It was one of the best memories of our trip. One thing about DC is that many attractions shut down after 5 and one doesn't always know what to do to occupy that time. We absolutely LOVED the bikes and we rode out to Jefferson Memorial which is hard to get to otherwise. I would have felt better having a bike lock to secure our bikes when we got to places, as I was afraid someone might steal or take our bike, so that might be a suggestion to bring along.....but it all worked out well and was a cheap and fun way to see the monuments."
C R,"Evanston, Illinois",1,04/18/2016,Impossible to dock the bike!,"This morning I lost an hour biking around in the hot sun trying to find an empty dock. I spent so much time that I missed an appointment. I went to 3 full bike thingies and met a guy who had also had 3 unsuccessful attempts in the opposite direction! I called the phone number on my printed receipt in tears because by this time I had to eat or would have a diabetic ""low"". Really ! You guys need to plan ahead or don't offer the bikes. Finally I went back to a bike location I had been to before, and a van was there taking bikes off the docks so we could dock our bikes. Worst bike share in DC!!!!"
craigcN9891HF,"Columbus, Ohio",4,04/18/2016,This is the way to get around the mall area,"We visited Washington DC the weekend of the Cherry Blossom parade. We have CoGo in Columbus, same bikes, same parent company and decided to commute by bike as much as possible. There are docking stations near just about every major and a few minor monuments. The station close the Lincoln had a long line of people wanting to get bikes and a long line of people checking them back in.As we use our local bike share all of the time we are familiar with the rules and how to make them work for you. Read the rules on the website or kiosk first. You don't want to end up getting charged more than you should.I only gave this one 4 stars and the one in Columbus I gave 5. That is because I rode 3 different bikes and all three needed some maintenance done to them."
ffmunson,"Joliet, Illinois",5,04/15/2016,Second best way to see the sights,In town for conference. When got done for the day went and rented the bike. Used the 3 day rental. Can use it when and wherever you wanted for the three days.All you do is put in your credit card answer a couple of questions and remember your code. So much nicer than walking all over the city. Just use the bike lanes and be careful. Only thing was not having a bike lock... However nobody stole our bikes.Have Fun.
Amy C,"Philadelphia, Pennsylvania",5,04/09/2016,Freedom on Wheels,"I try to bike in every city that I visit but knowing the horrendous traffic quagmire that is DC I was a little reticent about biking in DC. That was until two days ago when I took Amtrak to DC and decided to give Capital Bikeshare a try. What a great experience. The bicycles are in great shape, the kiosks are easy to use, the response time from the kiosks is quick, and the kiosks are located in very convenient locations. I would suggest that bikeshare find a way to let riders tell the system what maintenance needs to be done to each bike ( a missing bell on one, a slipping second gear on another).I was very brave and road up Mass Ave all the way to 15th Street from the very convenient Union Station Bikeshare kiosk. No muss, no fuss. Parked at 21st and M, went for coffee and then picked up a new bike to travel back across town to 7th and F. Capitol Bikeshare has a great website that makes it very easy to find where kiosks are located, if there are slots available at the kiosk of choice, and helps you plan your trips. I think that from now on when I am in DC I will skip the Metro, bus and cabs - I will use Capitol Bikeshare and have freedom from waiting in underground caverns for crowded subway cars, paying for parking in lots, and searching for elusive parking spaces.Next time you are in DC, give Capital Bikeshare a try. You won't be disappointed."
MatLet,"Roswell, Georgia",5,04/09/2016,Rented it for 3 days,"My son realty wanted to ride a bike around the city instead of doing the standard tours. Ended up being a lot of fun. You pay for a 1 day or 3 day membership and then you pay by the hour or half day or whole day. You can download an app to find the nearest bike stand so you can dock it and not be charged while you are touring things. Only issue is there are no bike stands on the mall. So if you are going museum to museum you need to lock it to something. If you are seeing this review before you go to DC then bring a bike lock so you can lock it up. We had to skip the museums as I did not feel comfortable leaving the bikes without a lock while we toured. We did ride them from our hotel on H street all the way to the White House, Washington Monument, on to WWII Memorial, Lincoln Memorial and then to the Zoo. There is a wonderful bike path to the zoo I highly recommend it. We did dock the bikes in front of the zoo and took the Metro home. "
IAKA2014,"Uppsala, Sweden",2,04/04/2016,"Good that they exist, bad that they are overpiced and unsafe","Washington D.C. is not a city to ride a bike. The traffic is heavy, and the bike lanes are not safe (if they exist). Even if you decide to hire this bike, be aware that it costs 8 dollars for a day enrolment fee and then - it is free only first 30 minutes, then it is 2 dollars for the next 29 minutes and even more for the time to follow. With the Washington D.C. distances this means you have to pay constantly extra fees. Besides, if you are a tourist, it is always uneasy to find a bike stand (if you do not have mobile with the internet connection with you). It seems that these bike stands are deliberately hidden on the back streets, so you loose time just for looking for them and pay extra. And there are not enough of these stands. You can easily arrive with your bike and find no free slot to park it. Overall impression - Capital Bikeshare wants to earn money on you without thinking about your convenience and safety. In comparison to Vienna city bikes, for example, this provides bad impression. Not a single stand near National Gallery, or Space museum, of Natural History Museum, the most popular places. You have to make circles and circles in order to find a bike stand on the back side of the Orangery (not the most obvious place!) and to walk from there."
pearlkrg,"Milwaukee, Wisconsin",5,03/30/2016,Spontaneous Self-Guided Evening Monument Tour,"Streets and paths are too congested over Spring Break to ride bikes during the day. We took an evening bike tour as a family and it was a highlight! After endless walking and weary feet, we covered a lot of ground and enjoyed seeing the city lit up at night. Evening monument tours were sold out but this was still fabulous and much cheaper. Just know where the stations are to dock near the Lincoln Memorial and Washington Memorial when you want to take a closer look. Read other reviews to understand the pricing system first. "
nuttiskyn,"Boston, Massachusetts",1,03/21/2016,Horried Customer Service,"Be warned, their customer service will not help in any issue. Be sure you use a credit card that will accept and process a chargeback since their customer service dept. is incapable of assisting. Buy a nicer pair of shoes, take a cab or the Metro."
Laura D,"Athens, Georgia",4,01/16/2016,Bring your own helmet,"The rental bikes provided my family a convenient & inexpensive way to get around. We were able to get to all of the museums & monuments quickly on our own schedules. My only complaint is that there were no helmets to be found anywhere in all of Washington! Any real cyclist knows that people who ride without helmets are referred to as ODs (organ donors). As a nurse, I did not feel comfortable allowing my family to ride in the streets without helmets. Fortunately, the locals did not seem to mind us riding on the sidewalks (still not safe, but better than riding in traffic)."
wanderingkale,"Valdosta, Georgia",5,12/29/2015,Great system for getting around,"So for 8 bucks, you get unlimited 30 minute trips for a day. There are so many bike share stations around the popular landmarks, you can't go wrong with this. We were able to basically see all the monuments and memorials in one day thanks to grabbing a bike and riding around. A great system."
280AshleyC280,"Charlotte, North Carolina",5,10/28/2015,Great way to get around,"I love how bike friendly DC is! They have biker paths everywhere and lots of stations with the bike share program so pretty much anywhere you are going within the area a station is close by. Its $8 fee for the day. Then you can use the bike for 30 minutes for free, once you put back in bike station the time is stopped. I think its about $2 for each additional 30 mins you have it out, but you could easily stop at a close station check in and check back out to keep the free time going. It was a great way for us to get around and tour museums/monuments "
kaioatey,The Bay Area,3,10/23/2015,good but... more expensive than it might seem,"At first this looks like a good - and fair - deal - you rent a bike for 1.5 hours for $16. But this is just a teaser - every 30' extra will set you off another $8. Thus, this service is best if you plan to have several trips of limited duration, but with total time <90 min. I really do not see the reason why they would need to set such extortionate prices. Then of course there are the unpredictable snafus... you trying to park the car late at night just aching to go to sleep and find all slots are taken; so wearily off to find another parking slot God knows how far away. I'd recommend for short distances in an area with many bike slots and parking spaces. Otherwise - the company will bleed you dry. "
D b,Merced,4,10/19/2015,Visiting Memorials the Easy Way,"We had walked the National Mall, Grey line toured and done the hop on hop off to visit the monuments and memorials but nothing has beat the bikeshare ride. My husband's knees are bad and I'' jus plain out of shape so when we decided to take our grandson to Washington over fall break we weren't sure how we would visit everything that he wanted to see. We got off the metro at the Smithonian stop, rented the bikes and off we went. We were able to visit everything and ride over to the White House. Most of this area is flat or a very genial slope which seemed to be downhill both ways!The app isn't GPS enabled so we had to do a little searching for the kiosk and is not entirely accurate on the availability for returns. We did the daily rate and kept the bikes for the entire time. If you were wise and returned them every 30 minutes the 8.00 daily fee is all you would pay."
SFantle101,"Bellevue, Washington",4,09/23/2015,A great way to see DC,"What a great concept - bike on demand! I used it extensively during my extended weekend visit, accompanying two locals with ""real"" bikes. Even though these bikes are built like tanks and only 3 speeds, I was able to keep up and felt pretty comfortable (beware of chafing after riding too much though). The lights are mostly for being seen, rather than seeing, so be careful riding at night. I found out the hard way that the service is only available in the District, as my ride across the bridges to Virginia ran up a hefty fine for a late check-in. I see from other reviews that there are stations in Maryland, so that helps. Seeing the city by bike was much more fun than driving, especially once I understood which streets were bike-friendly."
vinyl45s,"Valley City, Ohio",4,09/20/2015,Worth a try but know how the system works!,"First lets start off that people need to understand how this system works. Most of the complaints here are because they do not read or understand how the bikeshare works. Do people really think they are getting a bike for $8.00 a day and that is it? It is a membership and if you go over 30 minutes without checking in the bike there will be extra charges.Do keep in mind there will be bike stations that have no bikes or there are no docks. There will be bike that do not work and docks that are broken.You want to make sure if you are riding and pass a bike station to check the bike in,. You can not be sure your destination station will have empty slots. You can get 15 minutes extra time if there is no slots to drop the bike. However you need to know where the next station is. That may also be full. There are maps of the locations at the stations but there is no place at the station that you can check the status. There are apps available for cell phones but they are not that reliable. They are not always up to date or the app does not work. The Capital Bikeshare app it has for itself never worked. Try Spotcycle or others.We had two bikes and rode about 15 miles over the two days and 2 1/2 hours hours of use, It was easy to check in the bike and get the same bike out again. There we a few spots there were no empty slots. What we did if there was only one slot was to check in one bike, get it out again and check in the other bike and get that out again. That we we got another 30 minutes until we could find an open station. One time we had to go to 3 stations before we could return both bikes together. One time we had to check-in and leave one bike and then go drop the the other bike at the coral bike station at 13th and New York Ave then walk backKeep in mind commuters ride the bikes to downtown to work and take them back near their home. We found walking and riding around that most of the bike stations where full around the downtown area and the museums.during the day with people waiting for an empty slot to open up.We used the bike system for 2 days and had a day key card for convenience. We could have got a day membership or 3 day membership but then you have to use a code each time. There is also the question of the deposit charged for each bike. I never got a clear answer from customer service on this. We were not charged a deposit with the day key card.There is also a problem with Capital Bikeshare answering e-mails. They don't respond. Not once did they respond to any e-mails I sent in weeks prior to the trip. I ended up calling most times.. I also brought it to there attention of the negative reviews here and other sites that they should address. They did not seem to care.Still we wanted to give this a try. It worked out fine even with the hassle of finding a open bike station to drop a bike. The bikes are nice and study and easy to use.Give it a try but know how it works!"
