User_Name,User_Location,Stars,Entry_Date,Entry_Quote,Entry_Content
Gabriella P,"Albuquerque, New Mexico",5,08/28/2017,Awesome way to see the city in one day,"I'm surprised with all of the bad reviews on here, the bike share is really not that hard if you follow directions. You sign up at a station using a credit card. You will use same credit card throughout the day to receive a code to unlock your bikes. The most you can link to one card will be two bikes. So if you have a family of 4, you will need two cards. Not a big deal, but can be inconvenient. We did the 24 hour pass for 8 bucks each. Basically, you unlock your bike and you have 30 min to drop off at another bike station. You can literally just drop it off, swipe for another code and check it back out. I don't see why you would wanna keep it out for more since you stop at a museum or memorial and walk around, who would wanna walk around with their bike? The stations are located all over the memorials and cities. I downloaded the app and could click on a station to see if there was docking available and or bikes, and this also gives you a way to plan out your day to see everything. The app is updated in real time. If you happen to get to a station with no docks available, you can request a grace period to find another station. Also when you check your bike in, just make sure the light turns green to know you checked it in correctly. They will also send you a text message. I absolutely loved it, there's no way we would have been able to see all the sights at the mall without this. We didnt miss our 30 min deadline once, so all day it was just $16 for both of us! If i had to do it again, I would have chose to go on a weekday for less crowds, easier to ride. "
scuba840,"Tucson, Arizona",1,08/25/2017,SCAM SCAM STAY AWAY FROM CAPITAL BIKESHARE ,"Even though you purchase a multi hour rental,  you still get hit with very high hidden fees.  What makes these fees hidden?  They are not prominently disclosed at the time of rental...  You should avoid Capital Bikeshare like the plague.  I feel defrauded."
MaKu70,"Munich, Germany",5,08/25/2017,The best way to experience Washington DC.,"What a great way to get around in DC!I spent 4 days in the city and used the bikes every day. Signup is done in a minute or two and you are on the way. You have unlimited 30 minute rides. That seemed to be not so easy to understand for some but was pretty convenient. If you need a bike longer than 30 minutes, just set a timer and ""return"" it to the nearest station after 25 minutes and rent it again right away. After the initial signup, renting is just a swipe of your credit card, pretty fast. I had some stations where the touchscreen or the credit card reader wouldn't accept the card right away but in the end it always worked.Make sure you install the Spotcycle app! It helps you with finding bikes and stations."
disneybonvoyage,"barto, pa",3,08/21/2017,Mixed Experience!,"I did a bit of research before renting these bikes, so I was aware of the 30 minute time limit. * Get the app- This will tell you the location of the bikes and how many are available at that station.* Enter a cell phone # so you get a text about the rental.I was not aware of the 2 bike per credit card limit. If you need more than 2 bikes, have another credit card on you.This was a great way to move from the top of the mall to the bottom quickly.The problem came when we returned the bikes. All 3 bikes received a green light to indicate the bike was properly docked. I also received (2) texts. Here is where I messed up. I though that meant the (2) RECEIPTS were successful. However, it actually was each bike, meaning (1) of the bikes was not successfully docked even thought we got a green light. About 30 minutes later I received a text that we were being charged additional fees for being over the 30 minutes. I called and spoke with a gentleman who asked if we were near the bikes. We were not. He said he would send someone to dock the bike. He was very pleasant. This put a damper on our time as we knew ""I Agree"" to the $1200.00 cost of the bike if anything were to happen to it. It was quite the bummer on our trip. About 45 minutes later we received a text that the bike was successfully docked. OMG was I so relieved. The cost of the bikes should have been $6.00 for 3 bikes, but I was charged $2.00 on the one credit card and $4.00 TWICE on the other credit card. Seems others have been overcharged much more so I did not call to dispute the charge. Although it does seem like they make their money by overcharges.The charges do seem confusing on the website and from other reviewers as you can take the bikes out for longer time periods, but it is a small extra charge per 1/2 hour. (makes sense) I just dont see how it adds up to such a large bill as other posters mention. I would do this again, but I would be very cautious in making sure everything has been returned properly and make sure of the charges to my credit card."
TheDomss,France,5,08/09/2017,Excellent to discover Washington,"Excellent way to discover the city.We took a one day pass and as we liked it a lot a 3 days pass.The city is so huge than you can quickly move to the next place.For us the best way was to switch between biking and walk.For those who wants only bike for hours without stopping, it is perhaps better to rent bikes. "
YarivI,"Rehovot, Israel",4,08/09/2017,Very good way to see everything and fast but not in a car,"There is no much to say about riding a bike but few points.1) This is a great way to explore the city.2) Know that not everywhere you can reach and sometimes you have to leave them behind with all it means, someone has to watch or take a risk.3) With every CC you may rent only 2 bikes. And every card has to make a membership for 7$ a bike, this sucks a bit.This not include the rent time.4) Be careful and when there is rain you waste your rent time, this sucks as well."
Liane T,,4,08/08/2017,"Ideal for frequent, short trips","DC is a great city to see by bike, and capital bikeshare makes that more convenient. I like that I can take a short trip by bike, and once I dock I don't have to worry about it anymore. If I want to take the train or an Uber to my next stop, no problem! However, I'm using this as a local taking short trips. I could see this being a quick way for tourists to shuttle between museums and monuments, but it is NOT an economical option if you want to be physically riding bikes for more than an hour or so at a time. That said, while it's unfortunate that many reviewers were surprised by the charges they incurred, capital bikeshare is certainly not a scam; their pricing structure is very clearly laid out on the kiosk where you rent them. To me the biggest downside is that the bikes can sometimes feel clunky and heavy."
Molikorp,"Santiago, Chile",5,07/30/2017,The best way to know Washington,"For just 8 dollars, you can get access to bike rides all around Washington. I spent 3 days there and without this bike rental system my experience would be completely different. The city has many bike routes and LOTS of this stations, so is very easy to find available bikes to ride and lots to park them.It also counts with a free app called Spotcycle where you can check near stations and how many bikes are on each one."
cgmd76,"Arlington, Virginia",1,07/22/2017,Capital Bikeshare is BANKING on novice users to make a docking mistake so they can profit.,"I rented two bikes for my daughter and myself at Wilson and 31st in Arlington on July 21. We literally had the bikes for 10 minutes -- just enough time to ride to the bottom of the hill and dock them at Arlington Mill Road -- less than a mile away. This was only my second time renting from Capital Bikeshare and I didn't re-dock the bikes properly. I happened to check my bank account on July 22 about midday and noticed a charge of $62 in addition to the $4.00 rental charge from Capital Bikeshare. I called and spoke with two different representatives who explained that one bike was returned five hours later to a station on Four Mile Run and the other had not yet been returned and was still accusing charges. Maurice said they could authorize a one-time courtesy reimbursement of half of the charges -- which could not be finalized until the other bike was returned. I drove down two the Arlington Mill station and located the bike that was parked but not properly docked. I locked it into place and called back to speak with a supervisor. After calling back several hours later, I was told a supervisor would contact me at 11 pm. Irene did call me but said exactly the same. It was my fault for not docking the bike properly, the instructions are clearly printed on the kiosk, and she could only authorize half of the charges refunded. I said I found that outrageous as an annual pass costs less that my total charges -- which amounted to $157.00. I could have purchased a day pass, a three-day pass, or an annual pass for less. I asked to speak with someone above her and was told there was no one. I called back later and asked another representative, Cynthia, for the name of Irene's supervisor. She said Ashley and Irene are the only two supervisors; there is no one above them. I find it extraordinary that a business can blindly rob people, legally. Capital Bike Share is BANKING on novice users to make a docking mistake so they can profit. If they cared about the customer, they would notify customers via text when their time is near expiring -- that would be GOOD business. I never received any notification that the bikes had not been docked properly -- even though that is a question addressed on their FAQ page. If I hadn't checked my back account, that bike would still be accruing charges. I am just asking for a little kindness and compassion. I understand that I made an unfortunate mistake, but this is absolutely ridiculous. Give me an annual pass OR reduce the rate to $25, and IMPLEMENT A NOTIFICATION SYSTEM to customers! I will make sure every online reviewer hears this story and I will never rent from a this company again -- absolutely no humanity!"
carloatx,"Austin, Texas",5,07/21/2017,"This is the way to see the National Mall, BUT YOU MUST KNOW HOW TO USE IT!!","For $8 you can get a 24 hour pass to rent a bike. You must return and dock the bike within 30 minutes though or you will get overcharged! Download the spotcycle app and it will show you where the bike docks are in your area and how many bikes there are in real time. It really helps and I had no problems. When docking your bike, make sure the light turns green which locks the bike. Some docks aren't working properly so make sure the light turns green. When getting another bike out, you will use your credit card to get a new code. They will not charge your card again. It just gets you a new code to get the bike out again. If you do this correctly, you will be able to see the entire National Mall and all memorials in one day! BUT REMEMBER TO RE-DOCK YOUR BIKE EVERY 30 MINUTES!!!!"
sangerrob,"San Diego, California",1,07/19/2017,"system is hard to use, I was charged $94 for an hour use - company won't refund overage","Bike system is hard to use, I was charged $94 for an hour use - company won't refund overage. Walk or take uber, not worth the hassle."
marksevenquarter,"Toronto, Canada",1,07/19/2017,Rip-off!,"We absolutely loved these bikes.....until the bill arrived.. Wow - talk about misleading signage. Beware. You must re-dock your bike EVERY 30 MINUTES to avoid overage charges. Impossible in most cases. the sign should clearly spell out the cost of using these bikes. they should not be used by anybody who wants to bike for more than 30 minutes in total. They apply creative billing once you are done and the line-by-line charges are not predictable at all based on what is posted at the racks. If you are sight-seeing, find a different way to get around. It would have been cheaper to bring our own bikes with us on the plane!"
JanMadmanD,"Prague, Czech Republic",3,07/19/2017,Can be very expensive if you dont know how to use it:),"Always remember - you have to dock the bike every 30 minutes. Doesnt matter what kind of plan did you buy! allways check if your bike was docked properly!! Otherwise you got in trouble. Especially if you are a tourist. But otherwise it could be a very confy transport in WDC. (so to be honest, one day cost me once about 50usd and once I had to go by cab 10miles to dock my bike properly again :-D)"
Vonschmidt,"Houston, Texas",4,07/11/2017,Great experience ,I read the details of the charge system up front and its relatively clear 8 dollars for a 24 hour access pass which then allows you to ride the bike. Beyond this there are multiple levels if charges 1-29 min it's free after membership. Dock the Bike and get another right away. However if you go thirty min up to hefty nice then it's two dollars. Same procedure dock and recent the clock stops ticking. Go over the hour and it get expensive nine dollars for sixty to minty minutes. Beyond this it's stupid expensive like seven hours for ninety eight dollars. So the trick is dock it every thirty min. Other than that good bikes great trails best way to see the parks. Dock often 
Kristine O,,1,07/07/2017,TOTAL SCAM! BEWARE. DECEPTIVE COMPANY,"We live in DC. My son's bike was broken, so I suggested Capital Bikeshare for the afternoon. The $8, 24 hour rental turned into $78!!! I called @bikeshare to find out what happened and they told me that you have to DOCK THE BIKE EVERY 30 MINUTES!!!! How unrealistic and ridiculous. Don't use them. You will be ripped off."
pradeeppeddineni,"Philadelphia, Pennsylvania",1,07/07/2017,RIP OFF SCAM!!,"It's a rip off scam, be aware of 8$day passes. These are not unlimited for a day(24hrs), u have to dock the bike for every 30mins, and get it extended. or else you'll end up paying hefty bills to cc. Try talking to customer service u might have chance of 50% refund."
CathyR1886,,2,07/04/2017,Check you bank account...,"I will say, after being in DC this past weekend and renting 2 bikes, I would never tour another city any other way. This was a great experience... until I got home and checked my bank account. I rented 2 bikes at $8 each and we went over our 30 min by just a few minutes, twice. I should have been charged an additional $8 total for those few minutes, which I knew I would be. I was charged $98 and when I called they said it was because I didn't dock one of my bikes correctly the night before. This also explains why I couldn't get my bike on Saturday. I had to use a different credit card to get my 2nd bike and spend another $8 for a new 24 hour rental. I made sure both bikes were docked correctly according to the lights that blink. I'm being refunded $92, but no apologies or accountability for a flawed system, at best."
Andrés G,,1,07/03/2017,Be Careful - Poor Information ,"I rented 4 bikes for 2 hours 57 minutes last week and they changed U$128 to my credit cards. Their explanation was:""You purchased a single ride pass which cost $2.00 each. The single ride pass includes one ride of 30 minutes or less, when you have a trip duration over 30 minutes then you incur usage fees. The usage fees are calculated base on the duration of the trip. Your trip duration is 2 hours and 57 minutes incurring usage fees of $30.00.each bike""Unacceptable, expensive experience!!"
William S,"Traverse City, Michigan",1,07/03/2017,Scam,"This company is a scam. The ""all day pass"" is extremely misleading. It is not truly all day, it is all day 30 minutes intervals of docking, so if you go over 30 minutes without docking, you get charged. So you cannot ride anywhere for longer than 30 minutes, and you cannot ride anywhere that doesn't have docking station, but sure, let's call it an all day pass, that couldn't possibly mislead anybody. I got hit with a $62 charge on top of the $8 ""all day pass"" charge. Really? They also will not refund you the full amount when you call and explain what happened.Don't waste your money, rent from a real bike shop. I could of bought a bike for the price they charged me."
dacastevens,"Charlotte, North Carolina",1,07/01/2017,Rip Off,"You think the bike costs $8/day to rent - NOT!  Beware if you don't dock the bike every 30 minutes they charge huge fees!  $94 for us for one bike!
Customer service said these are only for commuting, not hourly rental!
Complete Rip Off!"
Richard C,"Washington DC, District of Columbia",1,06/25/2017,Great Service ruined by absolute rip off charges - BE VERY AWARE OF THE SMALL PRINT!!,Used this service in other major cities including London and NY - used it in DC to show some visitors around the main DC monuments. Its very misleading when you take out the 24hr pass for - what you think - is $8 per person. Only later did I notice that they had charged me an additional $76 for riding around the capital for 3hrs!! Got a very sarcastic woman at the help line explaining to me that its clearly stated on the receipt paper from the machine (NO ITS NOT!) that there would be extra charges for more than 30 minutes usage at a time. It wracks up to $8 per 30 minutes after the first 90 minutes - complete rip off!!!
EmagW,"Baltimore, Maryland",1,06/18/2017,Awesome Ride Awful Upcharge due to Unclear Procedure,"My friends and I loved riding these bikes around DC. We were in from out of town and enjoyed getting the exercise and the adventure of finding the bikes at the different docks and heading down from Adams Morgan to the mall. We happily and smugly rode around the enormous mall and covered so much more territory than we ever could have on foot. We stopped and ate at a fun restaurant, parked (not docked) our bikes and fully enjoyed our day... until ...the next day my friend checked her credit card and we got the sticker shock. Two bikes -- $108 for 4 hours of riding! And we signed up for $8 (x2=$16) for 24 hours. What the heck? WE HAD NO IDEA THAT WE HAD TO DOCK THE BIKES EVERY 30 MINUTES AND TAKE THEM OUT AGAIN IN ORDER TO KEEP THE CHARGE AT $8. Had we read Tripadvisor's bad reviews we would have known. Too many people have had this happen to them. Bikeshare refunded half, and their customer service was able to explain clearly on the phone that this is the procedure, but nowhere in the written verbiage does it indicate this odd procedure. The procedure makes sense if one thinks about the bikeshare being a commuter service first, but tourists need better information about this funny check-in, check-out thing. I had checked out the website to see how it worked beforehand, and $8 for 24 hours seemed simple enough. The grid of pricing shows upcharges for time ranges, but the overriding message was $8 for 24 hours and so the upcharges felt like they belonged to a different category. I am disappointed that such a great idea and well executed system cannot simply add this language to their website or FAQs. I have no doubt that tourists like me might have chosen to pay some upcharge for the convenience of having them out for longer, OR we would have enjoyed the challenge of finding docks every 30 minutes like a treasure hunt. I would guess that the 25% of 1 star reviews (at this writing) would be 4's or 5's if they would fix this problem of understanding. AND I think Bikeshare would earn their upcharges with knowing consumers rather than getting the upcharges from consumers who end up feeling deceived. Just so unnecessary. PLEASE note the procedure and the upcharges if you go past 30 minutes without docking, and THEN have a great ride!"
Loperotti,"Mogi das Cruzes, SP",4,06/17/2017,The best choice,"I loved rent this bikes on Washington, is easy to rent and I think is the best way to go to the attractions but sometimes you have a problem to left the bike in some points because they was totally full of bikes and you need to find another place near of the attraction to left your bike. "
Jayre,"The Woodlands, Texas",5,06/11/2017,The BEST way to see D.C.,"What a great idea!! We chose to forgo entering any museums on this trip, deciding to simply explore all the monuments. We started at the Supreme Court and made our way down the National Mall all the way to Arlington Cemetery. After then looping around the Tidal Basin we made our way to Georgetown where we returned our bikes. It was a full day adventure, and at our pace. It was remarkable!!! I will admit to being shocked about the final cost ($120 for the two bikes for 6 hours of rental). That part seemed rather deceptive in light of the ""24 hour membership."" But, considering all we saw and did it was worth it."
GCandcrew,Edmonton,1,06/07/2017,Unethical company,"Renting bikes to sight see is always a good idea, which we (2 adults) did for an evening, paying Cn22.31 for 24 hr ""membership"". We spent 3 hours with the bike, and later, back home we had the very unpleasant charge of an extra Cn$116.30. Thought there was a scam, somebody cloned our card, etc and called the company. We were then informed that you need to park the bike every 30 min and take it out again not to incur extra charges. And those charges get progressively bigger...and where were those stations where you were supposed to ""check your bike in out"" placed? Are we all supposed to ride for only 30 mins and look for those bloody bike stations rather than enjoying the scenery, monuments, etc...? Most people won't do that or go over time by the time they could find such things. Designed to be a perfect scheme to rip people off, who, like us, thought, as in many countries we have visited, we could keep the bike for a determined amount of time for a fixed charge. I noticed as i was posting that I was not the only one that felt to that sad scheme. Taking advantage of people who actually prefer to rent a bike to see the city being ecologically friendly. I suggest look elsewhere, there should be more ethical business of the type around"
Lori H,,5,06/05/2017,Only way to see the city ,This is the only way to see the city if you have limited time. The bikes are easy to rent and multiple locations to pick up and drop off bikes....I would suggest downloading the app for ease of use. The city is very bike friendly.....there are bike lanes as well as ramps on sidewalks. The way this works is you pay a membership fee either for 24 hours ($8) or you can do 3 days ($17) then you pay each time you use the bike. If your ride is less than 30 minutes it is free so the best thing to do is have a plan and once you enter your code to get your bike ride there and drop the bike at the nearest station. Once you set up your initial account then it reads off of your credit card and it is much quicker to get bikes. Make sure when you drop your bike the light is green and the bike is secure before you walk away. 
stephanie s,,1,06/02/2017,Scam! Don't use!,"I would not recommend using their services for bike rental in D.C. First of all they'll trick you by saying you can rent bikes for 24 hours for only $8 and later when you check you're credit card you incurred more charges from them cause it doesn't tell you that if you have it out longer than 30 minutes you will be charged extra. Then when you do try to return the bike near your destination good luck finding an open spot, you'll have to ride an extra 10 minutes past your destination to find another docking point and then walk back to your destination. Save your money and your time and go with someone else. "
AngM6,"Atlanta, Georgia",5,06/01/2017,They're everywhere! So easy and cheap! Use the app to find them,We rented two bikes for one day and used them all over town to visit the monuments and museums. Saved our feet from a LOT of walking. Very easy to use (I recommend downloading the app to see how many bikes available and where they are located). D.C. is a very bike friendly city and I would highly recommend this cheap way to get around town to everyone.
Rose-Anne M,"Sydney, Australia",5,05/26/2017,Excellent customer service,"After having a terrific experience on the bikes, I had an equally terrific experience with the customer service team. I accidentally failed to dock my bike properly, resulting in a very big penalty fee. When I explained the situation to the customer service team, they were flexible enough to split the difference with me, refunding me half the penalty even though it was really my fault. There was no arguing about it, they were pleasant and made the decision quickly. Awesome activity, awesome staff."
449warrene,"Windham, Maine",5,05/24/2017,Fun way to see the sights,"What a great way to move around in the touristy areas of DC. The prices are reasonable, the system (once you run through once or twice) is easy to use. Once when we were returning the bikes one didn't lock properly. We called in for customer service and were treated very nicely by a real person. Not only did she help us get the bike accounted for, she helped us understand how the payment system works. The hint is, ""return your bike every 30 minutes to avoid extra fees."""
Charlestonmike,"Charleston, South Carolina",5,05/19/2017,Best way to see DC,Loved the option of utilizing the bikeshare. Understand the system before undertaking. A payment of $2 gives you 30 minutes with the bike to then be returned at any of their bike stations (there is a good phone app that helps track the bike stations and availability of bikes and return slots). If you go beyond 30 minutes you will then be charged extra fees. This applies even if you purchase the 24 hour pass. To stay within the fixed rate and keep from additional fees you must return the bike within 30 mins. All in all it is a much better alternative than taking a cap from one monument to another. Highly recommended if you do not want to walk.
