User_Name,User_Location,Stars,Entry_Date,Entry_Quote,Entry_Content
BikegoddessJulie,"Chicago, Illinois",4,06/04/2014,Capital Bikes makes it (kind of) easy to visit great sites,"I was in Washington D.C. this past week and decided to utilize their bike share program. To be fair, I am from Chicago and a member of the Divvy program which is run the same way so my familiarity with the system is high. I ended up explaining how the program worked to someone who was looking quizzically at the instructions on one station.Things to know:*You can buy a 24 hour or 3 day pass*This pass is good for unlimited use in that time frame however, you must redock your bike every 30 minutes in order to not be charged excess usage fees*You swipe a credit card to get started following the onscreen instructions*You will receive a 5 digit code which you can use to unlock any of the bikes at the station*Be aware that if a bike needs servicing, the seat may be turned around to show that it should not be selected*I suggest you set your seat height, numbered for future rental use, and any bags in the open sided basket before you enter the code to remove the bike*To remove the bike you may have to lift the rear of the bike to angle it out of its dock*Get on, make sure the bike work, watch for traffic and roll*Redock your bike, go back to the kiosk and reswipe your credit card to get a new release code to take a bike back out. The wait time to redock and get a new bike is about 30 seconds I believe. Use the same credit cardI highly recommend you download the free app SpotLab which will show you the location of other docks and offers a timer.I rode over to the National Mall and had a great time riding around, however I found that there was a surprising limitation of bike docks where I thought there should have been. There were no docks by the Vietnam Memorial and you cannot/should not bring your bike into any of the monuments anyway.There are a decent amount of bike lanes in DC that I would recommend riders use.The app said there was one open dock by the Lincoln Memorial, however when I got there and rechecked, there were in reality no open docks. I think there was an issue reading one of the bikes. I reswiped the previously used credit card to request 15 more minutes to try and find another open dock.I also used the bike to ride around various neighborhoods on my way back to DuPont circle area. It was a great way to see some of the homes, offices, consulates and was very enjoyable. However, always be a careful rider and obey your signals and stop signs. Nothing ruins a day more than ending up splat on the hood of a car, especially if you blew the right of way."
L A,Idaho,5,06/01/2014,"Save your feet, rent a bike","After one day of walking the national mall, we were coveting the bike riders. They are easy to rent and easy to ride. We were able to see so much more by bike. Cost is reasonable too. Only downside is after docking them, there is a chance you won't get one again in that location."
E W,"Washington DC, District of Columbia",5,05/30/2014,Best way to commute or tour DC!,"For just a few dollars a day, ($7) getting around DC can be a breeze! Just be sure to re-dock your bike within 30 minutes, and simply pull out a new one--otherwise you'll incur some steep fees. Download the Spotcycle app to locate the 100s of docks where you can pick out and return a bike. There is a great rack on the front with ample room and a stretch chord to secure your items. The seats are easily adjustable with a quick release tab, and the bikes are comfortable and easy to handle. Have fun!"
mcmcBill,"Brussels, Belgium",4,05/30/2014,Nice way to see all sights around The Mall at own pace,"Initially I had thought we would buy tickets for a hop on hop off bus tour, but given their inflated prices and time required, we decided to create our own program around The Mall with bicycle and use public transport for the longer distances. Registering at a rental station was not as easy as explained, some cards were not liked even though advertised as accepted. Some better/updated explanation panels are needed.Had fun cycling around. If you time it right, you can make use of the first free 30 minutes of use (after paying the $7 day membership) and swap bikes before your paid minutes start counting.Nice way of getting around and seeing the sights and getting to know a large area in a short time. On The Mall and surrounding streets you are allowed to cycle on the sidewalk by exception."
herd_of_6,"Cedar Rapids, Iowa",5,05/28/2014,"Save your legs, rent a bike for the day!","We spent five days in DC sightseeing and 10 plus miles a day on concrete is hard on the legs. Our last day there we decided to do the capital bikeshare and what a wonderful way to see the city! I see some reviews about the site being misleading, it's not, you just need to read the instructions. They spell it out very clearly. NEED TO KNOW ABOUT RENTAL:If you read their website and understand how it works you'll be happy.* There are a few different options, getting a key or getting a code. Since we just rented one day so we did the code. Each time you want a bike you swipe the CC you reserved the bike on and it will print you out a code. You can choose a bike and go. * Understand the pricing structure. For the daily rental it was a $7.00 base charge. Each time you unlock a bike you get the first 30 minutes free and then an additional rate is charged for each section of time. Example: We rented and rode to the National Cathedral (and got lost) so it took us longer than 30 minutes, think it was about 55 minutes, we had an additional $2.00 charge for that specific trip since it took us 55 vs 30 minutes. The rest of the day we rented five more times (back to the mall and didn't get lost, around the tidal basin, up the mall and a few other stops in between) and there was no additional charges since we kept each trip to under 30 minutes. Over all we put on 28 miles and paid $9.00 for the day which I think it really reasonable.*There are bike racks all over the city, there's a great app to tell you how many bikes are available and how many slots are open. The BIKES:These are NOT commuter bikes, and they were a far cry from the road bike I am use to. They are heavy, there are only three speeds and they are built for ALL body types. I wouldn't plan on riding one out to Mt. Vernon by any means. But they are great around the city and mall and for stents under 10 miles. The bikes we had were all in good condition and were comfortable. They also do not come with helmets. If you stick to the trails it's not a bid deal, but riding up to the Cathedral was a little hair-raising in DC traffic. If your planning ahead pack a helmet. Great to see a program like this, very user friendly and a great way to see the sites."
TJ SA R,"Johannesburg, South Africa",5,05/26/2014,Great way to see the city!!!,This is a must do if you like the outdoors! Stations are conveniently stationed around the city. Convenient setup and 3 day rental a good deal. Bikes are well maintained and there were always bikes available. DC has great biking trails and lanes all around. Enjoy it! 
Sistersonatrip,"Commerce, Texas",4,05/10/2014,sightseeing while saving your feet ,Kind of complicated at first! 24 hour pass is $7 only if you return within 30 minute intervals. Basically rent it. Ride somewhere you want to go or just for 20 minutes. Return it at next station. If you want a long ride return it at a station within 30 minutes and grab another one as soon as you return the other! Best way to travel the mall and see Jefferson! 
katemackenz,"Oshawa, Canada",1,05/05/2014,Misleading Company Charges More than Expected,"Like many others here I experienced the misleading nature and false advertising offered by Capital Bikeshare in Washington. It leads you to believe you will be paying $7 for 24hrs which seems very fair and reasonable. This is not the case and I was charged over $20 for 2 hours only. This is very disappointing, as no one renting these bikes would have read through every single agreement written on those small screens before renting their bikes. It is unfair and this company is taking advantage of the fact that tourists would rent the bikes without reading each and every single page of agreements. In Canada I would be reporting this business to the Better Business Bureau as I say they are operating a scam and are relying on those individuals who would not fight to get their money back."
ronpoole,"Riverdale, New York",5,04/30/2014,Easy and fun,"Bikes are in excellent condition, stations are in convenient locations, and DC is more bike friendly than it used to be!"
Vandy K,,5,04/30/2014,Best way to see the sights,"So convenient, with stalls abundant through out town. A little pricey, but so worth it! Your feet will thank you! The Jefferson Memorial is a long way out there folks! Note that you can only rent 2 bikes per credit card and they dont accept American Express. But check out the informative website for pricing and map of all the many places to return your bikes at the end of a long and exciting day. We returned at Union Station, went in to see the beautiful train station, had dinner and then took the night tour to see it all lit up! I've done the mall many times, and this is definitely the way to go. It's flat easy riding, the traffic is mainly pedestrian, and no crowded buses to deal with! "
Travel_Bug81,"Waterloo, Canada",5,04/23/2014,Easiest Way to Get Around and Very Affordable,"The Capitol Bikeshare in Washington is one of the best that I've experienced. There are tons of stations around the city, and it's super easy to get around. It also helps that there are many bike trails and bike lanes, so there are designated spots for bikers. The city is very bike friendly because the population is mostly young and 40% of the people don't own cars. This means that the cars are also well aware of bikers and are used to them on the road, which helps.The way it works is this:1. Get a membership. It's $7/day or $15/3 days or more for longer periods (you can get a yearly or monthly membership also I believe)2. Use your credit card at any of the bike stations in the machines provided to buy the membership of your required length3. Once you buy the membership, you will get a 5 digit code. Use this code to enter on the little pad beside each bike. Once the light turns green, pull out your bike (sometimes have to use two hands)4. The membership allows you unlimited use of the bikes in (and this is the important part) - 30 minute intervals. This means that you will have no additional charges if you return the bike to another station within 30 minutes. The city is small enough that most places can be reached within the 30 minute limit. The point of this is to allow other people to use the bikes as well, and the bikes are meant as a form of getting from point A to point B, not keeping the bikes for the entire day (although you can do this, but you may end up paying hundreds of dollars, like the poor chap that called the service a scam below. It's not a scam - you just have to read the instructions properly. You are charged for every additional hour you don't return the bike). If you don't think you'll make it in time to your desired station, you may stop at another station and request additional time. You do this by inserting your credit card, and pressing the 'renew' button. This allows you an extra 15 minutes to get to the next station that is closest to your destination, or if the station you wanted is full and there is no space to leave the bike.5. If you require the bike for longer than 30 minutes, you may return to the station, wait 5 minutes (or walk to the next station) and get another bike, repeating the process above. The five digit code you get the first time will only be active for 5 minutes from the time you get it. Every time you want a new bike, you'll have to get a new code by inserting your credit card into the machine. Your credit card will not get charged again - it's only used to determine that you've already purchased a membership and to get a new code.6. Returning the bike, make sure you push it in hard into the stand, and make sure the green light comes on - this means the bike is locked back in.. 7. For those that have smart phones, you can download the Capital bike app (available on their website or from the app store) that will give you real-time information about how many bikes are available at each station or how many free spaces are available, so you don't have to waste time looking for the next available station if the one you want is full, or doesn't have bikes. It's also handy because it gives you the locations of all stations.There are many stations around the city and it's very easy to use and get around. In the three days that we rode around, there was only one instance where the station was full and we had to find the next one (5 minutes away - press the 'renew' button to get more time). Since we didn't have data services, we didn't have the real-time information for which stations were full/empty, but we could still see the station locations. We found that biking was more convenient and cheaper than the metro because there are more bike stations than there are metro stations, so it was easier to get closer to our desired destinations. Not to mention being able to get a better look at the city, and get some exercise.If you use the service properly, you'll have a great experience."
artsands,"Denver, Colorado",1,04/21/2014,Scam,"We were led to believe the bikes would be $7 per day if we didn't exceed 8 hours. This company is a total scam and they tried to charge us $276 for the use of 2 bikes for 2 days. Their fee schedule is ludicrous, very poorly shown at the stations, misleading, and nothing but a scam! Go to a regular bike shop and rent a decent bike with helmets provided, etc. Read the other negative reviews that explain how these folks were taken in."
OntheRoadMom,"Washington DC, District of Columbia",5,04/15/2014,Best way for tourists to get around!,"Buy a pass and save on cabs.  Pedal around the monuments, around Capitol Hill, to the zoo, in Rock Creek Park."
Freido90,"West Warwick, Rhode Island",4,04/13/2014,Convenient!!!!,The bikes are a life saver! One day I walked all day it I was so tired after and didn't get that far.But when I rented the bikes I saw so much more and had fun riding the bikes. It's $7 a day. Totally use it!!
sdrewry,"San Antonio, Texas",5,04/09/2014,Great way to see the city!,These bikes are GREAT! Such a fun way to tour around. Biking on the mall at night seeing the monuments was one of my favorite things we did in DC! The call center is very helpful if there is a problem. Be sure and download the app so you can check available bikes and docks near you. It is a great app! NOTE: Be sure and put the key fob on a key chain or zipped in a pocket. Mine accidentally came out when I grabbed my phone from my pocket :-(
Bret B,,5,02/03/2014,Excellent bikeshare system,"Washington DC has it's issues, but the ability to get around without a car is possibly its best amenity.Capital Bikeshare is what every city thinking of instituting a bike program should emulate.With a membership, you get as many 30 minute rides as you like. And if yu use it alot, it makes sense to pay for the keyfob. No swiping credit cards at the kiosk; just insert the keyfob and the bike unlocks from the rack. Quick and easy.And they have kiosks everywhere!!"
DrewLuck,"Alpharetta, Georgia",5,01/01/2014,Best way to see the city...,"We rented bikes in DC on our recent trip. It was so easy to set up and we saw the whole city in a fraction of the time as it would take walking or riding the metro. Do yourself a favor and grab a bike when you are in DC. You can practically ride them anywhere (sidewalks, streets, parks), but don't ride them into the memorials/monuments, just walk them up or pop them on a bike stand. There are stands EVERYWHERE. They have apps that will show you where they all area and how many bikes are available at each one. The app we used was Spotcycle."
RPK89,"Melbourne, Australia",4,12/14/2013,A wonderful way to see the Capital...,"When we arrived in DC, with very little planned for our day trip from NYC, we had no idea where to start, but right out the front of union station I spotted these little babies and off we went. It is just like the 'Citi Bikes' bike share system in NYC, and I love both equally as much. It was a great way for us to see every along the national mall (I was ignorant to the sheer size of the place), and thankfully there was bike ports almost everywhere. We also tested the friendship (half hr free rule) by riding into Georgetown, and lucky for us we made it. It is a great way to see the Capital, and an entertaining one at that.I would highly recommend it!"
yyyzzz_utah,"Murray, Utah",5,11/10/2013,"Rode a lot, convenient, but rules not clear","I rode a lot this time I visited DC. Very convenient. It is better than using taxi or driving cars around town. There are many stations around town. And the number is growing day by day. Some minor gripes. It is not always easy to find the stations at night even if you have a map. There is no options for kids. Some bikes needs maintenance. I wish there is a clock on the bike telling how much time you have spent, since it charges fees for a ride over 30 mins. I wish there is a way to get safety helmets. Pretty good. Highly recommended."
0471sip,Tampa,5,11/06/2013,Great time!,BIke racks were everywhere. So easy to hop on and off. Machines were easy to use. Phone app for stations is fantastic. Can't recommend enough!
SandcruiserX,"San Francisco, California",5,11/01/2013,fun way to see more on the Mall,"inexpensive, easy, much more fun than walking.what would take hours to stroll on the Mall can be seen much more quickly on two wheels.it's a great thing for both tourists and locals, alike.the free smartphone app is an easy way to find stands to check-out or return a bike. do budget in a little extra time in case the stand you choose is full, that nearly happened to me as I was returning to Union Station. No harm done."
vanilla g,"Washington DC, District of Columbia",4,10/24/2013,An alternative way to see DC!,"I have been in DC for nearly a year and I never tried the red bikes yet until last weekend. I always see people going around with those red bikes and I pass by the bike stands every day on my way to work. So we (my boyfriend) rented 2 bikes for more than 4 hours and we paid $42 ($7 each for daily membership fee, the first 30 minutes is free, $2 per hour onwards). DC is a bike friendly place with dedicated bike lanes in most areas. You can pedal your way in the sidewalks too and the people respectfully give way to you.Compared to walking from one site to another, biking is way better! And it is more beautiful and magical at night! You can return the bikes anywhere as long as there is an available stand to accommodate your bike. As we returned them and had dinner in Chinatown, we were able to get them back (since we already paid the $7 day membership) and continued with our sight seeing.You pay using your card and it has been a week since, I believe it is well secured for using cards.It was a very fun and exciting experience and I'm set to being a biking tour guide when I have friends coming over to the nation's capital."
Tallmark1960,"Lynnwood, Washington",5,10/19/2013,The Best way to get around DC,"For $7 per 24 hours you can check at a 3 speed bicycle from one of dozens of bike stands located through out the downtown. Return the bicycle to another stand within 30 minutes and you avoid further charges. Exceed the 30 minutes and they charge you an ever increasing surcharge. ($ 2 for 31 to 60 minutes, 4 or 6$ if you exceed 1 hour, etc.) While it was a bit of a hassle finding a bicycle station at times that was a small price to pay to avoid additional blisters on my feet. Bicycling is the only way to get around the city."
mrod27,"San Antonio, Texas",4,10/18/2013,Bike the Sites!,Capital Bikeshare is the only way to see DC! Metros are crowded and you miss all the sites. Renting a bike is a great way to quickly navigate the streets of DC. WABA! (Where A Bike At?) is a free app that can point you to the nearest station with availibility. We purchased a 3 day pass for $15. There are usage fees if you keep the bike for more than 30 minutes but its very easy to avoid this charge by checking the bike in at the nearest stand every 30 minutes. Usage fees start at $2 an hour. Still a deal IMO. I suggest renting a bike at night to tour all the Monuments while they are lit up at night. This is a great experience minus the crowds.
SarahElizabethSch,"Charlottesville, Virginia, United States",5,10/12/2013,The ONLY way to do D.C.,"Forget crazy traffic and crazier traffic patterns--the ONLY way to see DC is with this bikeshare. My husband and I (who both grew up in DC), recently came back for a wedding and stayed in Rosslyn. Rather than deal with the headache of driving/parking/paying to park, we decided to bike over the bridge and spend the day hopping the attractions. The bikeshare made it simple and easy--the stations are everywhere!"
AAARGH_OH,MAYFIELD HEIGHTS,5,09/28/2013,BEST way to get around DC!,"So I was standing on the Mall near the Washington Monument with sore shins and feet from walking so much. I wanted to get to the Lincoln Memorial, but was dreading the walk. Then I see a row of similar bikes on locked racks. I see that I can sign up for 24-hour period for $7 and use a bike for free (no usage fee) for up to 30 minutes (30 - 60 add $2, 60 - 90 add $6). So I grabbed a bike and leisurely rode down the mall to the Lincoln Memorial, stopping at the WWII and Vietnam memorials. I returned the bike to the closest rack and moved on.After that I grabbed another bike off the same rack, looked at the map of rack locations all around the mall AND Washington DC, made my plan of where to go to next, then proceeded to tour the rest of the mall area. No walking needed.This service is fantastic. I saw MANY people using it and it makes perfect sense! No wasting time walking between distant attractions.By the way, the bikes are HEAVY three speed units not meant for any kind of speed. They are intended for leisurely use."
jeff_and_kayla,"Spokane Valley, Washington",4,09/25/2013,Tough finding docking stations without a Smart phone,"My wife and I made our first visit to D.C. the weekend following Labor Day for half a week and used Capital Bikeshare one day to get from our hotel at Dupont Circle to the National Mall. From the Mall, we headed off on the bikes to a lunch venue, then back to some Smithsonian museums, then around the Mall some more, and finally to a Metro station to head back to the hotel.The directions at each station are clear cut. Rental for the day is $7. Rental for 3 days is $15. You've got the use of the bikes for a 24 hour period if you rent for the day like we did. Every 30 minutes you must re-dock your bike at another station if you want to avoid additional fees, $2 for the next 30 minutes (31-60 minutes), $4 more dollars for the next 30 minutes (61-90) minutes. Payment options are credit or debit only. After docking your bike for the first time and ready to check another one out for another 30 minutes, you simply re-scan your credit/debit card at the pay station and follow the directions to retrieve your unlock code which is valid for 5 minutes. You don't get dinged each time you slide your card.You can dock a bike at a station and immediately check another one out too. There are docking stations all over the place, but a few times we couldn't find a station that was indicated on the online or station map, and many times we passed by stations that weren't on the maps at all. When I speak of these maps, I'm talking about the website and the ones at the pay/docking stations. There are no hard copy maps available. Since we don't have phones with internet capabilities, we felt lost on more than one occasion searching for another docking station. Reading other reviews, it sounds like their app is very helpful. However, we were always able to find another station within the allotted 30 minutes. A 45 minute allotment of time would be much better and leave the rider feeling much less rushed. If planning on using them to tour the memorials at the National Mall, you'll be very rushed or will have to skip stuff, dock the bike, and backtrack on foot. There's a station by the Washington Monument, one by the Jefferson Memorial, and one by the Lincoln Memorial on the west side of the mall where all of the memorials are.My wife had trouble with her seat staying put on a couple of occasions so make sure you grab a bike that has a seat that locks down tight. After sunset, we rode around the National Mall to see everything again, and that was great. The flashing LED headlights don't provide a ton of light however. The lights, I believe, are mostly there as a safety measure for you to be seen by others. There are other bike rental companies in town that offer usage for the entire day if that's what you're looking for. My wife used similar bikes in Boulder, CO earlier this year and had a bit friendlier experience than here in D.C. We'd certainly try these again, but would make sure we upgraded to a smart phone next time to make life considerably easier."
