,review_ratings,review_date,review_text
207,4.0,7/29/2016,I've been wanting to use the bikes since they first parked in NYC a few years ago and today I got the chance to...it was such a fun time...my only thumbs down was having to replace the bike every 30 minutes though I had a day pass...it shouldn't be this way if you have a day pass you should be able to keep them out until you're ready to return it. This became an issue when we rode up the West side Hwy because there are really no bike stands there so we had to come off by 85th street and ride down the busy streets to look for a stand...but outside of this it was fun!!!
208,4.0,8/13/2013,"Rented bikes for an hour and rode around the West Side of Battery Park and it was glorious! After the fact that it took about a half an hour to rent the bikes.  The bike machine wouldn't take any of our credit cards but finally after a phone call to Customer Service, the woman was very apologetic, it finally worked!! It costs about $14 for the hour, which is sorta steep, but it was worth it since we had so much fun.  However, if it was something you see yourself doing more often, definitely get the yearly pass for $99, it will save you lots!"
209,1.0,8/3/2014,"Guys ! People customer New Yorkers !!!  Watch wen you rent a bike for first time, $101 DSL for ""deposit"" you never see again !!!!    I'm don't recommend !"
210,4.0,9/24/2016,"My 1st try on citibike was when it first came out,did not read the instruction carefully ended up paying late return fee.Recently I signed up for a 3 day trial be4 committing to the 1 year pass,overall good experience.I live in Midtown Manhattan and it is the fastest way to go anywhere within the city."
211,5.0,7/31/2017,Had a little trouble at first figuring out how it worked but that was due to my own tendency to ignore the details. Some experienced Citibike usersr helped me out and after that it was smooth pedalling. I didn't get penalized for going over the half hour per ride limit once thanks to the abundance of docking stations throughout the city and text alerts. it was oversll a great experience.
212,3.0,7/7/2013,"Update:  I have calmed down now that my key finally arrived. I feel very much like Mr. Sweetchuck in this scene from Police Academy whenever I'm riding a Citi Bike:  youtu.be/gGPde9vFoqcSo far, I have had two reactions from strangers watching me ride down the street on my Citi Bike. One dorky looking white guy tried to high-five me and said, ""yeah baby, Citi Bikes!""  Then a couple days afer, an angry looking black guy said to me as I cycled by, ""look at you all hard on your Citi Bike.""  Not sure what to make of any of this. But so far, my impressions are: The Good:1  .Being able to bike somewhere and then return the bike and not have to worry about locking it up and/or your bike getting stolen. Also, really like being able to bike one way and then take the subway or a cab the other way.  I also like biking for a while and then returning bike and jogging the rest of the way. 2.  Bikes are sturdy and the fat tires makes them more stable. 3.  Bikes don't go too fast so probably are safer. The Bad:1. These bikes are no fun to ride, are heavy, and don't go fast. Takes much longer to get from point A to point B, compared to my road bike. 2. Like i said, these bikes don't exude style...just a way to get around.3. Sometimes I return a bike, it locks into the dock, but I don't get a green light. This is unnerving. I wish you could use the app to see if they have the bike in their system as checked back in! (you can check the kiosk) 4. Skateboard PUNKS (I can say that, as I used to read Thrasher back in the day). Fast forward to angry old man me, and I have to say, I don't like how every 10 seconds these morons lose control of their boards and they go flying into the people on their Citi Bikes!5.  People on bikes are oblivious to other bikers and without mirrors there are going to be a lot of accidents revolving around passing."
213,5.0,11/3/2015,"Very convenient,Always in a good shape.Can park anywhere.The way to go."
214,4.0,7/3/2017,Great service! Except the fact that you have to check in every half hour is a hinderance when you want to take a long bike ride .. I'm not sure the point of that rule.
215,1.0,7/3/2017,"My annual membership is about to expire, and I'm buying a single speed urban bike instead of renewing it.I live in Greenpoint and count on a bike to commute either to work or to the subway every day, and 9 out of 10 times I won't find a single bike in any station in the vicinity. I've sent more than 10 emails to them, and the fact that I literally get the same exact responses is nothing short of pathetic. They don't really care about their customers, and those copied and pasted responses clearly show that. They will tell that they re-balance the stations and are trying to improve the system, but after a year it only gets worse and I'm still waiting to see any station in the entire city getting re-balanced, just like the 30+ other users I've asked and also said they've never seen it. It's a lie and very disrespectful to their customers who are paying for a service that they can't use when they most need it.I won't be surprised if the bikes and stations start getting vandalized..."
216,1.0,8/11/2014,"This is by far the worst bike sharing system I have ever used.  Between broken machines and bikes it's pretty much a crapshoot if you will be able to use it.  The sad thing is I used the bike sharing system in DC, which was made by the same vendor, and experienced none of these issues.  The idea is great and it works well in other cities, but New York just completely botched the execution."
217,1.0,12/1/2014,"I wish I could give no star or even a negative star, if possible.  This review is specifically about their customer service & membership processes.  I paid for the annual membership over a month and a half ago and still have not received my member key.  I called in three times to at least get some updates on the status and no one gave me any details and kept saying I need to wait longer.  Also, they refused to take any action when I called in the third time (30 days after the purchase date) regardless of the abnormal delay on the delivery.Apparently what they say on the e-mail you get after paying for your annual membership is NOT TRUE.  When I got the e-mail, they said the member key should arrive within 3-5 business days.  When I called in after a week, they did NOT even send out the key yet.  I paid for my membership on Oct. 22 and my key was not sent out until Oct. 29.  I called in again a week after the day they declared they sent out and they told me to wait and call back if the key doesn't arrive within another week.  I waited for another 10 days and called in to check up on the status and ask if they can re-send the key and the only answer I got was wait till Friday evening, since it was Wednesday when I called.  (What kind of logic is this?)  I just gave up on arguing with them any more and decided to wait until I come back from Thanksgiving break.And... guess what? It's Dec. 1 and I still haven't got the key.  I'm done dealing with their failure with delivering what they advertised & promised and their terrible customer service.  I just sent out an email to their Customer Service and asked for a refund.  I liked the idea of Citi Bike, but I'm just going to ride on my own bike, since this is causing more trouble already than riding on my own.One last thing to add...  LOOK AT REVIEWS BEFORE YOU DECIDE TO PAY FOR THE ANNUAL MEMBERSHIP.  I overlooked reviews about customer service and I'm deeply regretting that I ignored."
218,3.0,12/19/2014,The Pros:Awesome for getting places quickSuper cheapSuper clean and well maintained Stations located everywhere south of Central ParkThe cons:Not enough bikesNot enough bikesShowing up at a station hoping to jump on oneAnd there are noneNot enough bikes Not enough bikes
219,1.0,7/1/2016,"Absolutely awful service! The kiosk is very unclear. It's absurd that you can only rent the bike for 30 min. Before you need to return the bike or be charged $4 per 15 minutes. $12 to rent a bike for 30min seems a bit high, on top of $4/15min. But I guess I should expect this from a bank, not here to help, just here to rip off more hard working people! Please rent from a local shop, they have better bikes."
220,1.0,5/8/2014,"Great concept, mess of an operation.I love using bikes to get around the city. Citibike however is a terrible company.Here's why broken docks, broken machines that don't print receipts, and arbitrary late fees.I AM CURRENTLY DISPUTING A $108 LATE FEE THAT I DID NOT INCUR. I check to make sure the light turns green when I dock my bike each and every time. If it does not turn green I call a service agent. Citibike has a record of me calling pretty much every day.The day they are charging me the late fee for was a day that I used the bike twice. They have it on record that I called about the earlier trip because the light didn't turn green. They are claiming I had the same problem with my evening trip, that the bike wasn't docked. I call every time. As was proven earlier in the day. The is no way for the customer to prove that they docked the bike except call every trip and print out a receipt every trip. I do call so that proved a fail. I tried printing a receipt but the machine was broken. Also they never informed me or billed me about a late fee until 3 weeks after the incident.So basically Citibike can arbitrarily bill you late fees (and they will) and there is not way for the customer to prove that they are right. Also, the service agents are not helpful, are often rude when there is a problem and seem comfortable scamming customers.My credit card company is currently disputing this fee (as they have done in the past) and I am going to contact the Better Business Bureau today and report Citibike. I encourage all others who have been charged late fees wrongly to do the same.If anyone wants to file a complaint against Citibike to the Better Business Bureau, here is their official address (Citibike does not make it easy to find this info)CITIBIKE aka NYC BIKE SHARE77 COMMERCIAL STREETBROOKLYN, NY 11222718 237 2878"
221,1.0,6/21/2016,"For the thousands of evening shift workers in Midtown, there are ZERO BIKES EVERY SINGLE NIGHT.  They are expanding to other areas but they can't even keep bikes stocked properly in Midtown."
222,2.0,6/26/2014,"I bought a $100 fixie from walmart.com. This has proven to be worth its weight in gold. Coincidentally, the $100 I spend on a yearly Citi Bike membership was worth its weight in garbage. Here are the issues:1. terrible technology, unreliable system. Docking might not work. Checking out an available bike is even more difficult.2. In high traffic areas you are almost guaranteed:2a. Never find a free bike when you need one2b. Never find a free dock when you need one.3. Broken seats, broken peddles, flat tires run rampant. 4. I live on the upper east side. still no CitiBike 1 year on...My advice: find a cheap bike and buy a thick U-Lock. Keep your bike outside and jump on and off whenever you need it. Wear a helmet."
223,4.0,5/20/2017,"Citi bikes are excellent source of transportation, healthy to work out  and great to tour in the city.i recommend it. Enjoy your ride!!!"
224,1.0,4/18/2017,"I suppose it could have been ok but the ($12) card I was issued for the day did not work. The checking in every 30 minutes is a joke because it stresses you out trying to make sure you obey their rules. So back to my card not working. I tried to find an agent to help me like they did when I first rented the bike and gave them my money. Nope, only credit card stands. I called for help and waited on the phone for appx 5 minutes for someone to help. They made me use my credit card again to get a paper code to manually plug in numbers and I knew in the back of my mind it was not going to be good. I had to call them twice because the first set of numbers didn't work the second time. Well, come to find out I had to put my credit card in each time to receive new numbers. Really?  Yep, they charged me for exceeding the 30 minutes...twice. So will I ever do that again? Not on your life. I should have had a clue when the bikes were Citibank owned. I have never had a good Citibank experience."
225,1.0,6/21/2017,"Worst experience ever! I will never use these bikes again, a cab is much cheaper and convenient. You need to use a battering ram and multiple attempts to dock this bulky over priced 30 minute ride. Even though you hear a click and think you've docked your bike, they will continue to charge you excess fees at the rate of $16.00 per hour. I had to drive an hour back to the city to re-dock a bike that had been sitting for over 5 hours in the same docking station. I'd give this review a zero if it were allowed"
226,5.0,5/30/2017,"Having a bike disposable at all times in NYC was amazing! There are bike stands everywhere, the bikes are good and NY is just a great city to explore by bike (in good weather) :) will definitely continue to use them over the summer."
227,2.0,11/3/2014,"The longer I use CitiBike, the more frequently I am UNABLE TO USE CitiBike.  Either its a dock station with 8+ unusuable bikes, or a stream of faulty codes spewed from an apparently impotent kiosk, or the kiosk just wont accept any form of payment.  I tried giving it compliments, but it seems CitiBike doesnt respond well to those either.Are you in the city for a week and desperate to throw your money away?  Buy a CitiBike pass."
228,1.0,8/1/2016,"We had our code/one of our bikes stolen, they were hard to ride and few docking stations. Cost more than they were worth."
229,5.0,4/15/2017,Easy to use & located almost everywhere just keep a timer so you don't exceed 30 minutes and be sure your bike is securely locked . Very fun
230,5.0,12/8/2014,"What a very fun surprise!! Biking in Manhattan!! I thought it was a crazy idea at first but after we figured out the un-docking process the fun began. Who knew that biking in Manhattan at 10PM on a Sunday night would prove to be such a good idea?!  Down load the app for your phone and set the timer.  IT's a blast!  Half the fun is looking for the next docking station.  The true test came Monday - a work day after Thanksgiving...so much more traffic.  While it's chaotic, the upside is that the traffic rarely moves very fast.  Great fun!! I highly recommend.  A great way to see, smell, and hear the city!"
231,1.0,7/11/2016,If you need a bike for 30 mins it's fine otherwise look elsewhere. We used them thru Central Park but you have to put them back every 30 minutes and the docking places are outside the park so you need to constantly be aware of time. We spent 1 hour and 45 mins we were late because we got lost in the park and was charge $26 for the 2 bikes then another $35 in overages. We could have rented other bikes for the day with helmets and locks for the same price. It was a rip off. Also you have to change your code for every new bike every 30 mins and put your credit card back in. That's if there are anybikes left and you have to wait 10 mins inbetween
232,1.0,11/2/2015,"This is ridiculous this is my first time and also will be last time in my life I ever use a citi bike. I got charge $50 for a 2.5 use!?!?!  The renting station is very confusing. Just read up some review knowing I am not the only one having this problem. We all thought $9.95 is for 24hr of use, but no you got to dock in your bike every 30min to stay to the $10 or you get will a overtime fee for every 30min this is so frustrating!!!!"
233,1.0,7/8/2016,"Unreasonable program where ""24 hour"" rental can still lead to overage charges! There is a requirement of re docking the bike every 30 mins, if it isn't redocked within that time frame, there are ""overtime"" fees associated. After re-docking the bike, the renter is required to use the terminal again and take out another bike code, for the same bikes that were just returned.None of this is clearly explained in the tiny, rushed atmosphere of renting locations. As a first time rider looking to explore the city, these kinds of requirements should be repeatedly, and clearly shown. I don't quite understand the requirement anyway as this is advertised as a convenient way of exploring the city, but how convenient is hunting down a docking station every 30 mins? My maybe 3 hour ride with 2 bikes ended up costing $25.68 for 2 bikes, plus overtime fees of $42.80 for each bike, totaling $111.28. I should have gotten on craigslist and bought 2 cheap bikes for that cost. The quality of the bike is subpar at best. They are heavy and hard to yield. Seat is uncomfortable to ride on for more than 10 mins. My wife had troubles trying to get on the bike on the lowest seat setting. She is about average height and has ridden plenty of other rental bikes without any issues. My overall experience was totally not worth it, and the final ""overtime"" charges will keep me away for good. Hopefully they get rid of these gotcha charges because the overall idea is great but implementation needs work."
234,4.0,10/31/2014,"I am a fan of the Citi Bike program and NYC's bike lanes in general.  I give it four stars just for EXISTING, where other cities have nothing.  As someone who commutes via bicycle 40+ miles a day on the city streets of Los Angeles, I think the existence of this rental bike program, and the accompanying culture of biking that exists in New York, is fantastic.Is the program perfect?  Certainly not.  The computer kiosks are not at all intuitive for first-timers or out-of-towners.  You have to request a new ride code each time you want to get a bike, by first pressing ""request new ride code,"" and then inserting your (same) credit card.  Pull up your bike to a station that's full of bikes, just before your time is up?  Requesting more time via the kiosk is also extremely un-intuitive.  You might also find yourself wasting time trying to dock your bike at a dock that is... broken.  Which can add pressure if you are trying to cut it close up against your time limit.  So, not perfect.  The Citi Bike smartphone app is useful for find the numerous stations throughout the city.  The bikes I used were in good working order, and despite having come unprepared, I put in 20 miles wearing my Allen Edmonds dress shoes I enjoyed riding around the city so much.  The bike lanes in New York feel  safe-ish (if you watch for car doors and pedestrians) and there is a general feeling that bikes have a place on the city streets here, or at least more so than in other places.  Cars look out for bikes (more often than I am used to), and don't make deliberate attempts to kill you.I imagine this program has a 2.5 star review average because of how the kiosks and docks function (or, rather, how they don't function).  That's too bad, but don't let it discourage you from trying it out!"
235,2.0,7/6/2014,"I have very mixed feelings about these bikes. On the surface they seem like a very good idea and it is nice to be able to zip around the city on a bike. However be sure not to have the bike for longer than 30 mins or else you are smacked with a ""late fee"" and then 45 mins late from dipping your bike you get hit with another fee. These rules are extremely confusing at first but once you ride around for a few hours it is more understandable. I felt like the entire time I was riding, it was like a race against time, there wasn't a whole lot of ""let's enjoy this scene"". Instead it is ""where is the next station with a kiosk"", and that is another thing you only can grab a bike from a station with a kiosk or else your walking. Someone needs to go back to the drawing board and fix how this thing is operated."
236,1.0,9/24/2015,"Their bloodsucking policy is the worst. They advertise this as a way to reach from point A to point B, however you have only half an hour to do that. As a tourist I failed to check in a bike in such a short time because a. there was no spot on one docking station and b. it can take much longer than half an hour to find one, especially if you are new to the city."
237,2.0,5/20/2014,"I wish I could rate this higher- as I am a founding member and have wanted something like this for AGES. The problem is that the system is really unreliable...from there NEVER being bikes available in midtown Manhattan when I need them, to the app showing half full icons on docks that only have 2 available bikes- both of which are usually broken- to a general lack of cleanliness, these problems have plagued this system since the get go. There are always a ton of bikes at Port Authority and Penn Station, but no one uses them. They need to be rebalanced onto Broadway and 8th Avenue but they never are. The system is pretty irritating and good luck when you find a bike that works or are returning it- no guarantee the dock will work at all."
238,5.0,4/23/2017,"Bicycles are easy to ride, stations are plentiful and the east and west side Green spaces make riding delightful!"
239,2.0,6/6/2015,"A fantastic concept that is being badly let down by execution.I ride the citibikes almost everyday but there are a number of issues that need to be addressed before they continue with their expansion.1) the docking stations probably 40%-50% of them seem to be broken and you cannot dock your bike.2)The bikes are not being serviced with brake pads needing to be replaced, bikes having no bells and gearing broken on bikes.3) the grips are degradable which means you end up with this black rubber on her hands after every ride.4) bikes are not being replenished at stations (there should be a crew that can see if a station is empty then more bikes need to be delivered likewise if a station is full then take some bikes away.)If the managing company could resolve there services it would be a 5 stars but sadly they don't seem to be interested in resolving these issues but more concerned about emails on expansion."
240,4.0,7/6/2016,"I love it. I signed up for the annual membership, and a month in it has paid for itself in my mind. Since moving to midtown, I rarely need to use the subway, but walking everywhere can take a chuck of time out of your (my) day, and that's how Citibike has really made an impact on my day-to-day life. My 30 minute walk to work, can be 10 minutes, if I want it to be, by hopping on a bike. I love that I don't own the bike, so I never worry about theft or maintainence. The only draw back is that in certain areas of the city at certain times of the day or night, I often catch the dicks completelt empty of bikes.  I get it, but it means riding instead of walking is not  a 100% certain thing, but so far, it's enough to make it very worthwhile for me. However, I now need to carry hand cleaner at all times."
241,1.0,10/22/2013,"CAUTION: NO FEE APPEAL PROCESSLessons from Citi Bike: Any fee that you will incur, even if they are due to station/bike malfunction, will not be refunded - despite a supposed appeal process. After purchasing 2 one-day passes, I was charged $102 in late fees even though I did return the bikes on time. Upon contacting their call center, Vera Thompson - the office manager - refused to right the wrong. Disregarding my intentions to use Citi Bike again if she simply would correct the error, Ms. Thompson hung up the phone refusing to consider my request. She stated that I had misread the services agreement.After getting run over by Ms. Thompson and two of her office associates, I would NEVER trust this service again. There's no guarantee they won't charge me or anyone an arbitrary ""late fee"" in the future. Beware."
242,2.0,9/4/2015,"I love how their almost everywhere, makes it convenient  to pick up and dock, BUT. Geeze these bikes are big and heavy. Riding this up the bridge is hell in my experience, the bikes need more gears but that's my opinion."
243,5.0,7/15/2015,"While I understand some of the other reviewer's complaints, I thankfully had no issues using Citi Bike! I went to NYC this past weekend (Friday-Monday) and wanted to get a lot of sightseeing done. I knew that taking cabs or uber everywhere would cost a lot, but that walking would take up time and put a toll on my body. I was excited to see that there was Citi Bike, as I've used them in Miami.I signed up for a week-long pass, as I needed a solid 3 days of use. I stayed at the Waldorf, which was pretty centrally located and had a docking station at 52nd and Lexington that always had a fews bikes available and plenty of open docks for dropoffs. From here I biked pretty much everywhere throughout the weekend. What's important to remember is that these are meant to be commuting bikes so that is why only the first 30 minutes is included in your pass. Knowing this, I would purposely map out bike stations to switch out my bike whenever I knew that I'd be going for more than 30 minutes. This system never failed me. The only time I rode for more than 30 minutes was when I wanted to stroll through Central Park. I knew that I would be charged a surcharge, but honestly it only ended up being just under $5 so that was totally worth it. Overall, this was a great system for me. I usually arrived in to my destinations in about half the amount of time that it took my friends to walk or take cabs (they didn't feel safe riding in the streets with traffic). Just keep in mind, that I did most of my riding over the weekend, where I likely didn't have to deal with nyc commuters looking for bikes.They did place a $100 security deposit on my credit card; however, it only was a pending charge and never processed."
