,review_ratings,review_date,review_text
1,5.0,5/27/2018,"It's not perfect, but I see Citibike as basically an essential public service that makes NYC more livable.I joined last summer and I'm so glad I did -- I get exercise, save $ on commuting, and, most importantly, save time getting from place to place. Yes -- sometimes there are app issues, or not enough bikes or docks available, or you get a bike with a bum seat, etc. It can't be perfect 100% of the time. But it's pretty freaking great. It's enabled me to see neighborhoods of this city I otherwise wouldn't, all on my own steam, faster than any other method would have allowed. It's enabled me to get to/from work in 10 minutes rather than 45 on the slow-as-molasses city bus. Given how terrible public transportation in NYC is these days (both subways and buses), it's been a lifesaver. - need to expand stations into northern Manhattan- need to pressure city to add more PROTECTED bike lines -- everywhere"
2,1.0,11/2/2018,"Beware when signing up for the annual membership! Bad customer service with inflexible policies!! Seriously question your decision to sign up...It's rare that I post about a business as I'm in the customer service field myself, but this one deserves the warning blast. I signed up for Citibike because I got a job in New York. Exciting! I immediately got an annual membership after I received the offer as I was super excited to bike around this city and enjoy the flexibility of the drop 'n go service that city bike offers with their plethora of bike stations. I reckoned that even if I didn't use the 50+ rides required to offset the annual membership, the flexibility would be worth it. Now I'm seriously questioning my purchase...Unfortunately, I found out that my company offered a discount using a corporate code (great perk!). I submitted a request to Citi's customer service center through their site and received a stock response of ""Members have 14 days or less to cancel and receive a refund for their membersips."" Yes, that's the exact response. I didn't want to cancel my membership. I just wanted to get the discount applied and I was 3 days over the 14 day period. So I let it sit for a bit. Que sera, right? Well, not in this case. For some reason, the response irked me every time I saw a bike station (again, there are a ton of them...) so I called into their help center. I politely asked for an exception to the policy and they informed me that the policy was actually 30 days but I was now over that period so there was nothing that ""the system would allow them to do."" Being a customer service advocate, I calmly explained that they should be able to do a manager override. They talked to their supervisor and came back with the same response. When I asked to speak with the supervisor to explain, they declined. I offered some feedback amounting to Citibike gladly forgoing the small amount of money to keep a customer satisfied and bolster their reputation as a friendly, flexible company. I mean, it's founded on the concept of flexbility, right?! Not so much.In that final conversation, I discovered that their customer service is a call center that manages many bike share programs with a variety of directives that limit their ability override their system. How ridiculous is that?! A customer service management system that prevents you from offering good customer service? Unacceptable. Perhaps one of their agents will deem this public post worthy enough of a reasonable response and they'll make an exception to this 14 day nonsense that doesn't directly apply to my request. Citibike needs to stop treating their customers like numbers and start offering the service that's expected."
3,1.0,12/23/2018,This used to be a nice town. This use to be a town where if you like to walk you walk down the street in peace. This used to be a town where if you're driving you drive down the street in peace. It was quite harmonious for New Yorkers. Then the darkness came. The citibike. Once they sit their asses on these cursed machines they ride down the streets disregarding every rule and law on the book. They mow down people on the sidewalk screaming for everyone to get out of the way. Ever since these things came to be it has been hell as a driver and a pedestrian and even a bi
4,2.0,4/23/2019,"I think Citibike is a wonderful service for the city, but it's customer service is:  wait for it .....unprofessional, reads from a script, cannot handle simple problems with simple solutions. It's Managing Director, whom I have spoken with twice is in the ball. His staff unfortunately is NOT.  I do nit write reviews, but Motivate, Citibike's operating company has a terrible with capital ""T"" customer service department. Two reps, SUMAYYA and KENDALL were passive aggressive, kept cutting off reception 4 x  phones. Please get your customer service reps name. Ask them to cure a simple issue. They hem and haw not to pass you thru to a Supervisor. This is a BLACK for Citibike. I seriously hope they clean up their act. It doesn't reflect well on the Bank. Having been a Bank president, when your customer service is shoddy, there is nothing you can say to the world to fix it up from a terrible phone presence. CITIBIKE get smart !!"
5,1.0,3/12/2019,"Not happy to be charged extra for using the electric bikes, even when i pay for the annual membership! Should just be a waived if you already spend $100 plus for the annual membership! NYC already has such a large population, I'm sure citibike makes more than enough money from memberships and day-pass users."
6,1.0,3/31/2019,"This program is a complete scam!  I signed up for Citi Bike yesterday and thus far have taken about four trips.  For my last trip, I docked the bike and even received a notification buzz in the app.  Then hours later, I received an email claiming my bike was still out.  I called immediately--the representative told me that she could put a temporary hold on the account while a technician went out to find the bike at the station.  And oh--if it's not found, a lost bike is $1200.  This ruined my entire weekend---within 24 hours of signing up, to possibly face a payment of $1200 because the bike didn't buzz in the system is beyond the pale.  I would NEVER recommend this program to anyone and in fact am waiting for tomorrow to call elected officials and consumer agencies about this ridiculous program!"
7,1.0,11/3/2018,I have not used any citi bike since mid October which was my first and last time. I was charged the general single ride and the late fee which was taken out of my account and I was totally fine with that. Saw there was a charge for citibike in Brooklyn on November 3rd---- I live in Manhattan. Made a claims and received and absurdly rude response. Luckily my bank protects me from random charges like this
8,1.0,4/2/2019,"Trap for tourists. Seemed like a good idea until I got charged over 160$ after I stopped using it even though I locked it up properly as directed. To top it off I sent a complaint to customer service and they never responded. Bikes are low quality too but hey, maybe you like to pedal harder than needed."
9,1.0,9/18/2018,"BE WARNED. TOURIST SCAM. THIS COMPANY WILL FIND WAYS TO CHARGE YOU EXTRA FEES AND MAKE IT IMPOSSIBLE TO REFUND.I got charged $108 for a 20 minute bike ride, that was supposed to be $3. Because the bike was ""not properly docked"". I had rode The bikes several times and it was for sure locked. But the timer on my app kept running. If this happens to you CALL IMMEDIATELY and you might not get charged. I learned the hard way. Every time I rode the bikes, the timer was lagging on my phone, after I locked the bike, but I knew it would stop, because it always did.  So I thought nothing of it. And I knew the bike was locked because I had done it several times, and it beeped, and I could not pull the bike out. I thought, there's no way they can charge me because the bike is locked, and they must know that.Well a couple days, later I saw on my debit card a charge for $108. I thought, that sucks, but no problem, this will will be  be a quick phone call and refund. NOPE. 5 calls later, and a few emails to management and the best they could do was refund half the money. So they still basically stole $50 from me.I don't live in NYC, and I know another person who the same thing happened to. It must be very common and for a company to make more money off ""error charges"" then legitimate use of their service, that's not cool. They make it really easy to mess up, and they charge you, and then they blame you and say it's your fault.Don't get me wrong, the few times I used the bikes it was amazing, and super convenient, and super fun. But I feel that this is poor business practice. And they do not care about the satisfaction of their customers, because they are making so much money and have lost touch with the human to human interaction. I am happy to pay $50 for something. But paying $50 for nothing is not business. It's a scam."
10,1.0,8/4/2018,"This company (Citi Bikes) is actively and knowingly engaging in deceptive practices and consumer fraud.I leased two bicycles for 24 hours at $12 per bicycle, totaling $24. I returned them after 1 hour and 26 minutes, yet I was being $26.13, plus another fee of $34.84, totaling $60.97.I contacted their customer service and they maintain they charges are valid, they did nothing wrong, and refuse to issue a full refund of the second charge. They say they charge an additional $4 per bicycle for every 15 minutes after the initial 30 minutes. Then what's the point of renting for a 24 hour period?I've filed a dispute with my card's bank, and will be filing complaints with government agencies.STAY AWAY!"
11,1.0,7/31/2018,"These bikes make it easy to get around quickly and there are many stations to pick from...The bikes aren't in the best shape - the tires are kind of flat, some of the seats are broken with stuffing coming out, and the brakes could use some tightening.The pay stations clearly outline the way the charges work - pay $12.00 and you can ride unlimited for 24 hours but you have to re-dock the bike every 30 minutes and get a new bike each time.We pay for two bikes - $24.00 for 24 hours. We ride for about 20 minutes, re-dock, walk around, find new bikes... And get charged again because the system doesn't recognize that we had already picked up bikes. Another $24.00.We dock the bikes in Brooklyn, they lock in place, and we go about our day. Wake up this morning and have a message from Citibike claiming one of the bikes hasn't been docked and we are getting charged for $1,200.00. We have tried calling customer service to rectify this issue, and their suggestion was to trek down to Brooklyn to re-dock the bike... Which may or may not be there anymore since their locking mechanism failed... Looks like others have had this problem. When the locks fail due to a power outage or because the mechanics fail, its the consumer who pays, not the merchant. Customer service is a joke, and they make you feel like you're the one who has ripped them off.Not worth it due to the lack of customer service and the pathetic rigamarole they put you through."
12,1.0,7/11/2018,"Horrible experience with Citi bike. The $3 per ride is only on the app. If you rent from the station, there will be $13.07 per day. They will double charge you if you ride over 30 minutes. I was charged $26.14 for a 40 minutes ride!   Don't use it!!!!! Horrible expensive!!!!!"
13,5.0,8/30/2018,"I was my first time today renting a Citi Bike. I took my first ride in prospect park, in Brooklyn. The App is pretty easy to navigate, and also getting the bike out of the dock. I had no problems with the bike I rode. I enjoyed my ride through the park. Hopefully there will be more bike stations in the area, closer to my house. Definitely will be riding more often, thank you Citi Bike."
14,1.0,1/16/2019,"Almost as pathetic as the MTA.  Even little Indigo in Philly is way better,Can't find bike or cant find docks or they do not work.  They only survive as they are the only show in town.  There may be too many taxis and car-shares in NYC but not enough bikes around.  Come on NYC let some some other dock-less bike-shares (Lime, SPIN etc) in!"
15,2.0,8/30/2018,"This review is for the ANNUAL MEMBERSHIP. If you live in Midtown and Lower Upper East/West, this service is simply a waste of money.  This is coming from a previously very loyal customer. As an NYC local, I originally loved using citi bike and looked forward to renewing my annual membership. However, recently that opinion has changed. I would give the service a 1-star rating for recent months, and a 4 or 5-star rating for the service they sold me a year ago. Bikes are rarely available in Midtown and Lower Upper East/West. Take a look at the attached pics. Several months ago, I could get a bike whenever and travel around the city with ease. Now, that is rarely the case. 4/5 times I look to use the bikes, there isn't a bike in a convenient location. If you live in Midtown or Lower Upper East/West then don't get the bikes. I'm not going to renew for another year and may try to get a refund on the last couple months, as the service hasn't been as advertised. No bikes to use. I'm now hoping Uber's jump bikes come into town. Another cost effective option for locals like myself."
16,4.0,4/13/2018,"Ah, Citi bike...what an adventure this was. Read on if you want to hear about the stuff nightmares are made of. I hadn't heard of this method of commuting, but my boyfriend suggested we give this a go as we were in town for the weekend. 24 hour accessibility for just $12? Sign me up! I briefly read through the general rules on the kiosk--firmly dock your bikes at citi bike stations, rides are limited to 30 minutes per session, helmets are suggested, stay alert, follow the rules of traffic. But what really caught my eye was the fee for a stolen bike coming in at a whopping $1200?! I pity the fools who have incurred this charge. I decided right then and there that I'd guard this bike with my life and would fend off anyone who'd attempt to poach it from me. NO WAY would I become a victim of this insanity. The bikes are decently kempt and you have the option of toggling between 3 different gears as well as being able to adjust the height of the seat. The citi bike is also equipped with a cute little bell that I shamelessly abused during my rides--I had become a biking maniac from the thrill and laughter that ensued throughout the day. Really, it was intoxicating. All was well until we attempted to check out another two bikes. We received an error message only allowing a discharge of 1 bike as the other bike was 'still in use'. My heart plummeted. I'm pretty sure I blacked out.Something must have malfunctioned at our former docking station, because both my boyfriend and I were POSITIVE we pushed them in correctly. We phoned support and they gave us the ID for the bike in question and were instructed to head back to our previous station. We rushed back only to find that it was missing. Someone had checked the bike out. 30 minutes passed, 60 minutes passed, 90 minutes passed and still no notification of this wretched bike having been returned. At this point I had already accepted my fate and made peace with myself that this'll definitely be the most expensive bike ride I've ever had. We were notified 2.5 hours later that the bike had FINALLY been returned to a station. We wept and sang and jumped with joy. All in all, I had a pleasant experience considering the circumstances...if you have any love for your derriere, avoid riding on cobblestone. And if you have any love for your wallet, DOCK YOUR BIKE CORRECTLY."
17,1.0,12/11/2018,Citi Bike has terrible customer service. I'll never buy a gift membership from them again. I bought it as a gift for my wife 3 weeks ago and she still hasn't been able to get her new membership. This in spite of all my unanswered email/help requests and phone calls. They also didn't extend her membership or give her a further discount for our troubles (something I asked for). Instead they just charged her for a new full priced membership which meant we had to make yet another call to them.
18,5.0,5/22/2018,"I've been a CitiBike user for the past two years now, and am very fond of the bike share system. I've got the annual membership, which costs about $140/year if you get the $25 may discount and a further 10% discount for Citibank card holders. CitiBike has spread immensely over the past couple of years, having great coverage over most of Manhattan and parts of Brooklyn and Queens now. You can use CitiBike for leisure/commuting and also for exercise; its heavy weight (45 lbs) makes it a good workout if you take it on an up-slope (Try the Manhattan Bridge). Just remember one golden rule: dock your bike in 45 minutes (or 30 minutes if you're not an annual member) and double check that you see the green light and hear the beep when you dock it (or that could be your most expensive bike ride ever at $1200!!!). The only issue I've had so far is not finding a bike when I really need one, but CitiBike is trying to improve that through their new Bike Angels program. Additionally, if you're at the end of your time-limit and really need to dock your bike at a station but there aren't any empty docks (or someone sniped you), don't just pass by! Go to the kiosk and they'll give you an extra 15 minutes to find a nearby station with a dock. Overall, I think the program is very well implemented and gets good maintenance, besides, CitiBike has some of the most fantastic customer service I've come across. They even shipped me a free replacement key when I lost mine, and are extremely courteous with most requests. I highly recommend giving it a shot!PS- a lot of people mention not knowing about the time limits/getting overcharged by CitiBike. In my opinion, CitiBike is extremely clear about the respective time limits and surcharges, and they're not in the business of fooling customers into paying more! :)"
19,3.0,9/26/2018,"Happy to hear plans for improvement from John.  I think there is still lot of room for improvement.  Here is my assessment of  you (I am a daily user).-  Citibike App . :        A+  (the best out there)- Annual membership cost -  A-  Finding a bike/dock when you need one (busy times)  - F- Dock and bike maintenance            -F(after I report a station problem, seems to take 2 months to fix it)- Latest technology .  :          C .  Pedal assisted bikes are nice, we need more of them.Overall               - CI have added one star :) .   I think they have the same problem as MTA , in the mecca of capitalism NYC they are a monopoly.We need some competition.  Come on NYC,  approve Lime & SPIN.Thanks!"
20,1.0,11/30/2018,Bike went missing because of a malfunction and they said due to circumstances they would postpone the almost $600 bike replacement fee if I kept my membership active. As soon as I updated my info to keep it active BOOM they still charged me $577 for a piece of crap bike that is somehow missing. And now won't waive the fee whatsoever and it took them more than 25 days to even call back and tell me the can't waive it. TERRIBLE
21,2.0,10/27/2018,"If you are planning on using during commuting hours make sure you test it out first.  I joined two months ago and Iive at CPW and 85th.  There are never any bikes in a 10 block radius.  If you commute during off hours it's amazing.  After signing up i tried to have my membership cancelled because of the lack of bikes and their customer service is the WORST!!!  So it's great for off peak hours...unfortunately, i cannot even use the service."
22,1.0,9/21/2018,"Total scam. Charged me an extra $52 because they weren't docked ""fast enough"" every 30 minutes. How is it considered a day pass if you have to run to another docking station every 30 minutes?After calling customer service I received a rude agent who must get these calls everyday asking for their money back. I will never use citi bike again. The bikes are also in horrible shape. Some brake, some don't. Some bells work, some don't. Total scam."
23,5.0,5/6/2018,"Annual pass is a fantastic value.   Very easy to start cycling, or to re-start if you haven't been on a bike in years. Smartphone app shows available bikes at the many stations, and then after you check outs a bike, the app shows a map with bike lanes and available bike parking docks giving you lots of choice where to return your bike.   Do not be intimidated by cycling in Manhattan, just try it for a few blocks. Only weakness of CitiBike is it needs to expand to South Bronx up to Yankee Stadium and eastward in Queens to Flushing.    But it is already great in its current service area."
24,1.0,10/1/2018,"I usually like Citi bike, great way to get around the city especially the pedal assist.  But the workers for Citi Bike sucks the big one!!!  I walked 10 blocks to get a pedal assist bike saw when the Citi bike worker changed the battery.   Another citi bike worker comes to take the bike worker #1 advised him that he is not suppose to be riding the bikes bc the customers need them. His response was ""watch me""It's already a shortage when it comes to the pedal assist bikes the workers should know this and have some considerations for the people who are looking to use it."
25,1.0,1/13/2019,"Sh*tty bike! They're always broken and customer service is non-existent, but sometimes it's the best of bad options. Be better citi bike. I know you wont."
26,1.0,9/1/2018,"My girlfriend and I rented bikes for 24 oursWith our fist 3 rides 3 of the 6 bikes we're jacked up in some way (2 didn't shift gears).You also have to wait 2 minutes bo get another one, pretty frustrating"
27,1.0,11/5/2018,First time using a citibike - used it to ride from WTC up to the Mega Bus station. I guess because my ride was a little over the half hour limit the charge went from $13 to $26. $26 for a single bike ride is absolutely insane. That is more than my megabus back to Philadelphia.
28,1.0,1/21/2018,"Had good experiences over the summer but not yesterday. Got a day pass, ride for 30 minutes and then two hours later got a text that bike was not returned and being charged overages. Called and was told bike hadn't been locked properly. I heard a locking sound and saw red light. Assumed that meant it's locked. Apparently not.  No other warning until that text two hours later. Support said go back to station and put it back in. Went back to docking station, bike is gone. Called support again and found out I could be on the hook for $1200 to replace bike!  Don't forget: they have your credit card and will bill you for some idiot joyriding the bike around. Check reddit, it's even happened to people who did dock correctly."
29,2.0,8/20/2018,"Citibike is great under two conditions. 1) you get a bike that actually runs smoothly and 2) there are bikes actually available at the docking stations near you. I started using citibike religiously despite often riding bikes where you had to exert 110% of your energy to barely move. Lately my new issue has been no available bikes. They poorly redistribute bikes in my area and when I reached out I was give a generic response that didn't even address the issues I brought up. If citibike truly wants to hold onto to its customers, they need to more regularly service their bikes and use the data they collect in their app to appropriately distribute bikes in high traffic areas."
30,3.0,2/18/2018,"While Citi Bike can be a convenient way to get from point A to point B, it is overpriced, and not always available.Citi has nice bikes which ride well and look trendy!However, I can only pay for increments of 24 hours or more. Thus if I just want to ride, say, 10 blocks in one day, I still have to pay a fee or $12 plus a fee (i.e. $13.07). There is no option to ride for, say, only 30 minutes.In terms of local availability, it's nice that there is a bicycle bank on my corner, and in numerous other locations, but there are seldom bikes actually in the bank nearest to my apartment. This can be inconvenient at time.I think this system can be improved by allowing other companies to compete in bike sharing , allowing smaller time periods of rental, and assuring bikes are available more often.Thank you Citi, but there is room for improvement."
31,2.0,6/4/2017,Works like any other city bike rental BUT there needs to be more stations..... DC has me spoiled..... why they don't have any at Coney Island is beyond me. Also their day pass for $12.00 bucks as long as you riding the bike checkout within 30 minutes is lame. I'm suppose to enjoy myself not watching a stupid clock and with the stations being far and few in between there is not a guarantee I will find a docking station in time. If you are riding near the water front go for it but I may just bring my own bike the next time I'm in NYC definitely if I am there for the beach.
32,1.0,7/30/2018,"These bikes are in really bad shape! This week so far I've rented two damaged ones. Bad wheels, bad coordination and horrible shifts! I don't know how often they perform maintenance on these bikes, but it seems that they are not doing the best job. Looking forward for more bicycle sharing systems in NYC thar are way much better when it comes to the overall operations and maintenance of their main product, a bicycle."
