,review_ratings,review_date,review_text
102,1.0,10/18/2017,"I've used citibike for years.. almost as soon as they opened.  To date, I've logged over 650 miles, 400 + miles and dropped 30 thousand calories.  I live in a doorman building, so I don't always have my keys on me.  Recently Citibike accused me of sharing my membership with others.. and deactivated the feature that allows me to log in using my credit card instead of bike token.  I find this extremely annoying as I live a very active lifestyle, have been a massive proponent of Citibike, and do not share my account!  Why would I ever give someone my credit card or bike token?!  That's insane.  I'm beyond annoyed with Citibike.  Thanks for being a crappy partner."
103,5.0,5/7/2018,"Living on the Upper East Side and having to rely on taxis or the 6 to get to and from work isn't always ideal. Citi Bike is a nice third option that gets me where I need to be in half the time of the subway and about equal to that if I were in a car (during rush hour). Bikes are usually easy to find and in good condition, plus the light and bell are a nice addition for night travel (although I hate how many time I accidentally ring the bell). All in all, not asking for a lot out of Citi Bike, but I am always happy with the service I receive."
104,2.0,5/5/2018,I had a Citibike membership last year and am considering renewal this year. I did not have any significant problems finding or docking bikes. My complaint is that the membership options are limited. Citibike should offer a month-to-month membership option rather than the current monthly payment option that requires a full year commitment. I would be more inclined to join if I could opt in as needed rather than paying $169/year with the limit of 45 minute rides.
105,1.0,8/4/2017,I love biking and was very excited to be able to grab a bike and ride through Central Park. I got a day pass for $12 and downloaded the app. This would be a great deal if you didn't have to return your bike every 30 minutes to avoid overage fees. Watching the time as you bike takes away from the experience in a major way. It stressed me out! I went over the time by 1 minutes and 3 seconds for one of my rides and was charged $4 for that. I even contacted customer service to see if they might give me a pass on that minute since it was my first ever ride with them. But they shut me down. I am very disappointed.
106,5.0,11/3/2017,I had an incredible experience. The parking situation was simple and convenient. The bikes were also good quality bikes. Very comfortable.
107,1.0,7/24/2016,"Absolute scam. They are so desperate for cash that they will do anything to collect money off your credit card. We took out two bikes for a 20 block ride, docked and headed into a store. When we came out we couldn't get our code to work and tried multiple stations with no luck. Already pissed I paid $24 and couldn't actually use the bike I hiked home 30 blocks with a dead cell phone. When I called them to ask for a refund they said I also had an additional $90 charge for 'overtime' and refused to refund either charges.  I had apparantly docked improperly but had received no calls, no texts, nothing. The representative said that she could see that I had 'improperly docked', coincidently BOTH bikes. 1. What are the chances we both docked improperly?2. Why do I get texts that tell me when I dock properly but not improperly? 3. I jammed the bike into the docking station and there was no getting it out. I do not even believe it was not locked in, it obviously just did not register.Don't even waste your time, a cab that would have cost  $5 cost me over $100 because Citi bikes are an absolute scam with poor customer service. I'm disputing the charge with my credit card company, I am absolutely not paying it."
108,4.0,4/27/2018,Well situated on the east side downtown to midtown. Bikes more decent for city travel than they appear
109,1.0,5/14/2018,"Citi Bikes are a good way to experience the city.  However, having to redock the bike every 30 mins is a joke and just a way to make money.  I paid for two day passes, which should have amounted to around $24-25 total. Instead, I ended up paying $60.00 due to keep the bike out longer than 30 mins per ride. They will try and say they make it clear, but they don't, and it's just another way to make money.  It's just a crappy way to do business but I suppose they're around to make money."
110,2.0,12/5/2013,I have seen this kind of bike rental in Europe all the time. Seeing in NY city.... bright blue color bikes.... get my attention right away!I try to look at the rental machine.... VERY COMPLICATED & CONFUSING!!! So not user friendly...... It is a great idea to commute in the city by bikes but seeing so many bikes parking there... make me wonder maybe the price or the operation is not so efficient that is why people don't utilize it.
111,5.0,4/23/2018,"Great first time experience!! Bike worked, the code to release the bike worked, and the rack to put it back worked. I liked the immediate text message confirming my biking was complete and my summary of miles and calories."
112,1.0,7/17/2016,"The bikes are OK and convenience is definitely a bonus but customer service and billing is utterly awful. After several unsuccessful attempts to dock my rented bike I thought I had finally docked it properly only to get a text 3 hours later that I was still being charged. I returned to the docking station, successfully docked my rented bike and found out that no matter what I said or did, I would be charged an extra $38 in overage fees simply because the company doesn't refund anything under $40. With failing docking stations and no ability to contest overage charges I would suggest looking elsewhere for bikes. Their system seems to pry on those who are unfamiliar with the process and catch fails set in place are conveniently set to incur the maximum non-refundable fees. Fail."
113,5.0,7/3/2016,"CitiBike has literally changed my life. I am not exaggerating whatsoever.  It has completely transformed how I get around the city.  I've been a member since 2014 and am thrilled to be coming into my third year as a member this fall.Pretty much all of the negative reviews of Citibike here are from tourists complaining about the 30 minute time limit...but these bikes aren't really meant for touring purposes.  Citibike is designed for busy New Yorkers who need to get from point A to point B.  Annual members get 45 minutes, which I've never even come close to hitting.Citibike enables me the convenience and freedom of getting anywhere in the city faster and more reliably than public transit, a rideshare service, or a cab.  A trip that could easily take me 35 minutes on public transit takes 17 minutes on a bike.  In fact, having citibike means I can live further east, enjoy my neighborhood, and pay less of a premium for living in Manhattan due to my distance from public transit.Citibike has made lots of improvements since it first started - newer bike models, introduction of valet service, a great app, continued expansion uptown and into the outer boroughs, and more.For locals, I would highly recommend getting the annual membership.  It's $160 a YEAR.  Compare that to $116 a MONTH for a metrocard.  I definitely city bike 9-10 months out of the year - I typically won't if it's snowing or below freezing.  That means I'm saving easily $1000 a year in transportation costs.And for the most part, it's a very pleasant way to get around.  I take it in the morning to my fitness class, and it's usually very calm and relaxing.  If I have a late night at the office, I thoroughly enjoy my 15 minute bike ride in the calm of the evening.  Sometimes commuting during peak times or along 8th Avenue at rush hour can be stressful, but all in all is definitely worth it."
114,1.0,9/6/2016,"It was a great experience to ride around the city but be careful to triple check whether your bike was docked (returned) properly! Why? Because you can be charged $1300 for this...Several tips --1. After you return your bike, make sure you see the green light.2. Make sure you receive a text saying ""You docked bike ####. To ride again, insert the same credit card at any kiosk to get a new 5-digit code.""3. You can also sign up for email notifications or app notifications if you wanna be saferCiti bike informed me about this $1300 charge in the morning. The customer service guy told me to file a police report if I want to avoid this charge... I went on reddit and saw several ppl facing the same situation as me. Suggestions to citi bike --1. It will be great if citi bike can offer some kind of bike insurance. Say we didnt dock the bike properly and some random guy stole the bike...i would rather pay for an insurance in advance2. I did not receive any notifications alerting me that I ""havent return the bike"" or ""your bike didnt show up in our system yet. Maybe you should do something about it"" texts. Maybe citi bike can start sending out this kind of alerts."
115,5.0,10/29/2017,"Best way to get around NYC!  Fills in the gaps for travel between the subway, bus & walking.  By far the best deal for people who live in NYC is the annual membership.  Gets you 45 minute rides between docking stations.  Plus, once you figure out the various docking station locations near the things & errands you regularly do, the traveling around becomes a snap!"
116,4.0,6/30/2017,They should tell you on the screen  when you buy tickets that for more than 30 min riding you  will be charged extra
117,5.0,7/24/2017,Citibike now has an hourly pass and it rocks.  Nice that they're finding options for all types of users...keep up the good work CityBike
118,1.0,5/31/2016,"The service started out as a great idea to get everyone biking, but its now a business that has disincluded a lot of us while reaping the benefits of the City's support.I joined for $99 a year.  The price went up to $155 a year.  (Although they keep offering me a $25 discount to renew, that is still $130).NYCHA residents and people with some high-brow organizations can pay $60 ... while fees for the disincluded are going up up up!  And CitiBike locations are in the high or low rent districts, not the more middle class areas.  Imagine if the subways and buses were like this?Just like so much else in New York...if you are rich you can pay whatever, if you are poor you can get some help or freebies (not that it's a bad thing), if you are in the middle you get squeezed.  I can't support it."
119,1.0,6/3/2016,"used Citi Bike first time the other day, not at this location but the dock station @ 8 Ave & W 33St. I thought it was truly amazing service to have until I found out that my credit card got scammed and have started receiving quite few unknown domestic & international phone calls like from India and Hungary.Well, I just literally activated my credit card few days before using this service and this is the ONLY charge that I made in a public location. So, the CITI BIKE is definitely one that my CC got scammed at.Even the phone calls, yes it could be a sale's call BUT I barely receive sale's calls until giving my # @ CITI Bike payment station.well, the charge was not that big but still.. I was really disappointed how poor their security measure is.."
120,1.0,8/28/2017,"Do NOT use Citi Bike in New York they charged us just over $230 for the use of 3 bikes for combined 4 hours.  Myself, my husband and 11year old daughter were tourist to New York after taking my son to West Point and took a ride around the city on their bikes not realizing we needed to check them in every 30 minutes. We asked for a refund of the overages as we were unaware and were basically told to go screw ourselves.  The pittance return was $6.97 on a $230.84 bill...  Seriously!What kind of a racket is this?  I get it's our fault as now we see the rules, but seriously tourist are absolutely taken advantage of by this service.  As a tourist to this city who would think you had to rack and unrack a bike every 30 minutes on a ""day"" pass.  Most tourist would think a day pass meant for the ""day"" as we did.  We toured the Brooklyn Bridge on one day, and City Park on the next and are saddened with our experience and the enduring horrible customer service by Sheila H and the manager William.  Sometimes stepping outside the profit made and being compassionate is the right thing to do.  I will never ever use the service again and I will make sure anybody I know is aware of our treatment.Should have known with a big bank sponsored name they would be big bank nickel and dime charges for the little people loaded with predatory fee practices for unsuspecting tourist.#citibikenyc #citibank #predatory #horriblecsomerservice #visitnyc #newyork #samschwartz #newyorkcity #tourism #billdeblasio #deblasio #cbsnewyork"
121,2.0,6/22/2017,Want to say I just went to London and Amsterdam and they also had their own citi bikes. It was so much better as I wasn't charged a deposit fee of $100 onto my debit card to use them. In London I think it was just about 2 pounds and then if you turned it in late you were charged 2 pounds more. It was great! In Amsterdam it was so cheap to rent a bike. If I ever need to rent one in ny again I will go elsewhere.
122,3.0,10/5/2016,I like the idea but bikes are extremely heavy and hard to ride uphill. 1st speed is a joke. You pedal and pedal but the bike barely moves making it pretty hard to keep balance.  3rd speed is hard to pedal yet the bike does not move very fast. Plenty of grannies on their private road bikes fly past me in central park.There is no respect for bike lines from both cars and pedestrians
123,1.0,6/10/2017,the worst citi program ever. a scam and robbed money. A day pass doesn't mean a day pass.
124,4.0,10/4/2016,"Very convenient IF you know what you're getting.First of all if you look at all the other reviews, you can see most of them are people who did NOT dock the bike within 30 minutes. (which I'll get into shortly)For $12 you get unlimited 30 minute rides around the city in a 24 hour period. This means you NEED to dock the bike within this timeframe to avoid an overage fee of $4 per every 15 minutes you have the bike. Again, all of this is explained, its just people not reading/understanding what they're purchasing which is sad. The reason behind the 30minute limit and charges is so everyone gets a fair chance of renting a bike, if it was truly unlimited, these things would be impossible to find. Just think about that for a second.If you have an iPhone, you NEED to download the citibike app, trust me it will make finding docks easy and it even tells you the availability before you go.To compare things, there was a guy offering me to rent a bike from the business he worked for and it was $15 for 1 hour. For $3 less ($12) you can get a citibike and use it LONGER and the only requirement is to dock it once every 30 minutes. There are docks in almost every corner of NYC so this isn't an issue at all.With the CitiBike I went all over times square and broadway with friends on a recent trip to NYC. We never had issues and we racked up around 8 miles riding/docking the entire day. I would definitely do this again on my next visit! Just keep in mind that riding a bike through a very busy city like NY can be dangerous and you need to be alert of traffic and signals at all times."
125,5.0,7/26/2017,"Citi Bike is numero uno when it comes to convenient, exciting and easy ways to explore the City of New York, the Big Onion as they used to call it.  It's now called the Big Apple by some, but those in the know still refer to it by it's old name, New Amsterdam, and those who know also use Citi Bike.  Now that there's an hourly pass, you don't have to worry about space docking every 30 minutes, just take it nice and slow.  It's the best, and you can't go wrong."
126,1.0,6/1/2017,"Purchased a day pass for $12. Later got a charge for $30+ for overage charges because I didn't return the bike every 30 minutes. Booking through the app has the day price of $12 in big bold letters and the extra charges in tiny fine print. So if I rent a bike for the full 12 hours I have to return it 24 times over the course of a day? So ridiculous. Congrats Citibike you got me, I will never use your service again."
127,4.0,8/5/2017,Great service. No station when I leave work in midtown which is a pain but I understand the difficulties of logistics
128,5.0,7/24/2017,They have an hourly pass for $6 an hour which is awesome. I love citbike.
129,4.0,8/5/2017,"Pretty expensive if you just want the bike for a few errands, and having to check in every half hour is crap. Other than that the system is ok and the idea is great."
130,5.0,2/24/2018,"I think we need more bikes on everything station, love this bikes, they have become my main way to get to work"
131,5.0,8/23/2016,I had a wonderful experience!! Was really helpful to trip around the city!!I highly recommend Citi bike!!!
132,1.0,1/30/2018,Deadly combo of raising rates whilst service is deteriorating..never any bikes or docks available especially at hot spots like GCT..don't really need an algorithm to predict that flow.. Some genius gave Citi bank a sweet heart deal when it was founded and all environment conscious NYers pay for it now..shame on Citi bank AND bike to not rectify that!!I canceled my subscription...
133,1.0,2/3/2016,"Please read my review with warning!!!Before I start I want to clarify I am not a stupid person, I went to college I can read instructions! I have just found out I have been charged $100 for 2 hours of biking for two bikes. Apparently you have to check the bike into the station every 30 mins or you get charged with this massive fine! I didnt see this clearly marked anywhere. Please take my example and make sure you avoid citibikes, or check them in every 30 mins!"
134,4.0,8/15/2017,If there were more working bikes (not Red Lights) I'd give it 5 stars. The only problem is that it's too popular and you frequently can't find a bike when you want.
135,5.0,7/24/2017,"CitiBike has done a great thing and added an hourly pass! 6 bucks an hour, no security deposit or overages... A really nice addition to their other options especially for tourists or out of towners looking to explore the city. I used to live in New York so an annual pass made sense, but as a visitor from the West Coast now it's nice to have these other options."
136,4.0,8/14/2017,Riding around the city with a Citi bike was a great experience however it sucked having to find a dock every 30 mins.
137,5.0,6/24/2017,Rode from 3rd Ave & 53rd St downtown to the Staten Island Ferry Terminal via the East River bike path. It was a nice ride and it was easy to use the Citi Bike station to undock & dock a bike. I plan to use it again.
138,1.0,6/24/2017,"Worst bike rental service I've ever used. If you don't want to have any overcharges given to you days after you even used a bike, DO NOT use this service. Customer service is just as useless."
139,4.0,10/5/2016,"Works in a pinch--especially in high-traffic areas. If you need to get somewhere in a hurry and it's on the other side of a busy area like midtown there is no faster way than to hop on a Citi bike. The alternatives will take longer (subway) or take longer and cost more (cab).If you're looking to do a little leisurely sightseeing these heavy, lumbering, upright bicycles could work for that, too, you just need to keep the re-docking rules in mind that many have mentioned here."
140,3.0,6/29/2018,"After renting single use twice, I received an email for $25 off annual membership. Great! but code did not work in app, waited for response by email which didn't arrive (did not wait 72 hours though)so called customer service and after a bit of time on hold got a code that worked. Love saving money! Now for the helpful hints to others-always check bike before unlocking-does the seat stay up, gears change, tires inflated, when returning double check that ride ends after docking- even with green light my first ride continued and went over (so much for above discount). Also since I am in Jersey City and wanted to ride to Hoboken Trader Joe's (why is there no Trader Joe's in JC?) it was next to impossible, only two(2) citibike stations up the elevator impossible to ride to! Coming back was dangerous flying down Patterson plank, no bike lane, potholes, road work-I was following the route on app! I am from California and the electric bikes, scooters, dock less and docked bikes are so much more plentiful and user friendly. Time for some competition here! Just saying, and how can I get a closer Trader Joe's?"
141,1.0,6/22/2017,Worst strategy to loot money from the people. Don't fall into the trap. Citi has to think of new ways to earn money
142,1.0,5/8/2017,Bike share. Great idea. FYI: must maintain bikes. Seats broken shifts don't work. Miserable. I can only rent one bike her credit card.
143,4.0,10/10/2016,"Citibike is a great way to get around the city. I use it for getting to social events in the evenings and weekends and sometimes for commuting too. It's convenient and a lot more fun than the subway and taxis. Before I joined, I was a little concerned about safety, but actually it's a lot safer than first expected. My friends also mentioned that there used to be a lot of problems years ago particularly around docking. It's easy to see that the experience is much smoother now and has definitely improved. In terms of issues, I've had only a few since I started riding earlier this year. These included bike chains not running smoothly and not being able to always find an open dock. Luckily these were few and far between and easily resolved i.e. using the wrench button on the dock & getting another bike (this works great, btw!) and checking the app before I ride to make sure there's an open space. Also, just a final note - while the bag space may be enough for some, it's a little trickier to fit a handbag and laptop bag for us pack-horse type commuters. A larger sized space would be a welcome addition to the next series of bikes! All in all, a great experience."
144,1.0,6/12/2017,"0 for 2 with bikes: first skipped out of gear, second wouldn't shift at all. Customer service was zero help. Not worth your money."
145,5.0,7/16/2017,Good location. Many bikes. Doing this review to see if I can get another discount. 25 bucks.
146,5.0,5/28/2017,"Excellent for getting around the city. We used CitiBike to see Central Park, The Met and grab lunch at Eatly in the Flatiron district. Just plan your day in 30 minute travel increments."
147,4.0,5/28/2017,Pretty good system and reliable service. Great for visiting sites in the downtown area. It would be better if the service expands to the other boroughs and Uptown.
148,5.0,7/1/2017,"It's surprising how much faster I can get around on the bike. No train delays. No fighting traffic in a car. Plus, I'm getting in shape."
149,4.0,10/12/2016,"Awesome alternative to the subway - super easy to use and makes New York seem so much smaller! Docks almost everywhere you look, and the app makes it easier still. Only gripe - the weight of the bikes!"
150,4.0,7/28/2014,"Lots of fun to ride a bike along the Hudson river bike path. I easily found bikes at the closest location. The kiosk interface was easy to navigate and the credit card reader worked well. I plugged in my rental number to the bike of my choice and zipped away. The trick with renting this bikes is to lift the seat when getting one from the lock mechanism. I rode from battery park to 16 the st in 30 minutes (needed a few photos), exchanged the bike to meet the 30 min limit, and rode back. It was terrific. These bikes, like those in Boston, Chicago and Paris, are wide seat heavy cruisers with 3 speeds. You can't go fast, but this also means its harder to harm yourself/ others. This is especially important since no helmets are available and you're riding in a city!  The price of this rental was a little high but still acceptable. Unlike my experiences elsewhere, there were adequate docking stations everywhere I wanted to dock in NYC, but I think thats only because I rode at 6 am!"
151,1.0,11/1/2015,"The Citi Bike sucks.  Charged me 40 dollars per bike for 2 hour usage.  Wont ever use it again.At the station, when you got the bikes, you thought you got a bike for up to 24 hours as the screen displayed"" 24-hour pass"". HOWEVER, It did not made clear at the station at all that you had to return the bike within 30 mins. WOW, VERY IMPRESSIVE on the TRICKS to cheat the new users. Any place within a 30 mins bike distance, why should I pay more than $10 to ride there and also have to look for a station to return it,  rather than just request a Uber? Greedy Banks... So sad"
152,4.0,11/26/2015,"Personally using citibike is a pretty neat way to explore NYC there are many docking stations around the city. The bikes have a place to put your backpack/bag they have tire guards, lights, a bell, and the bikes are all three speed. Key is remembering to dock the bike (if you rent it for 24 hours) every 30 minutes. I'd give a rating of 5 stars however, sometimes when I docked the bike and went to get the code the machine would run out of paper (remember the codes to pull the bike back out) or get stuck in my situation of thinking ""what on earth?! How do I pull the bike out again I don't remember the code, and there is no paper with the code"".With all that being said there are bike lanes so it not too crazy biking around in traffic but with the amount of tourists walking everywhere especially on the bike path I'd make sure you get the bike that does not have a broken bell or you'll find yourself constantly shouting ""bike"" or ""left""."
